free_text,address,price,price_meter,rooms,area,more,add_link,Powierzchnia,Forma własności,Liczba pokoi,Stan wykończenia,Piętro,Balkon / ogród / taras,Czynsz,Miejsce parkingowe,Obsługa zdalna,Ogrzewanie,Rynek,Typ ogłoszeniodawcy,Dostępne od,Rok budowy,Rodzaj zabudowy,Okna,Winda,Media,Zabezpieczenia,Wyposażenie,Informacje dodatkowe,Materiał budynku,scraping_date,address_new,Longitude,Latitude
Mieszkanie dwupoziomowe z kominkiem!,"Mieszkanie na sprzedaż: Osiedle Kościuszki, Olsztyn, warmińsko-mazurskie",749000.0,6683,4 pokoje,112.08,Biuro nieruchomości,/pl/oferta/mieszkanie-dwupoziomowe-z-kominkiem-ID4nZnX,"112,08 m²",Zapytaj,4,Zapytaj,1/2,balkon,Zapytaj,garaż/miejsce parkingowe,Zapytaj,Zapytaj,wtórny,biuro nieruchomości ,brak informacji,2004,brak informacji,plastikowe,nie,brak informacji,monitoring / ochrona,brak informacji,brak informacji,brak informacji,2024-01-16,"Osiedle Kościuszki, Olsztyn, warmińsko-mazurskie",20.4839688,53.7696979
Apartamenty Wyzwolenia | apartament nr 57,"Mieszkanie na sprzedaż: ul. Wyzwolenia, Śródmieście, Olsztyn, warmińsko-mazurskie",517824.0,12400,2 pokoje,41.76,Inwestycja deweloperska,/pl/oferta/apartamenty-wyzwolenia-apartament-nr-57-ID4nyxY,"41,76 m²",pełna własność,2,do wykończenia,4/7,Zapytaj,Zapytaj,garaż/miejsce parkingowe,tak,miejskie,miejskie,miejskie,miejskie,miejskie,miejskie,miejskie,miejskie,miejskie,miejskie,miejskie,miejskie,miejskie,2024-01-16,"Wyzwolenia, Śródmieście, Olsztyn, warmińsko-mazurskie",20.4781084,53.7788089
Świetne dwupoziomowe mieszkanie na Os. Mleczna!,"Mieszkanie na sprzedaż: ul. Jarosława Iwaszkiewicza, Podgrodzie, Olsztyn, warmińsko-mazurskie",587000.0,11013,3 pokoje,53.3,Biuro nieruchomości,/pl/oferta/swietne-dwupoziomowe-mieszkanie-na-os-mleczna-ID4nZeh,"53,3 m²",Zapytaj,3,do zamieszkania,2/2,balkon,700 zł,garaż/miejsce parkingowe,Zapytaj,miejskie,wtórny,biuro nieruchomości ,brak informacji,2000,blok,drewniane,nie,brak informacji,"teren zamknięty, domofon / wideofon",brak informacji,"piwnica, oddzielna kuchnia",brak informacji,2024-01-16,"Jarosława Iwaszkiewicza, Podgrodzie, Olsztyn, warmińsko-mazurskie",20.4701044,53.764205
Warszawska99 | mieszkanie 2-pok. | 14,"Mieszkanie na sprzedaż: al. Aleja Warszawska, Kortowo, Olsztyn, warmińsko-mazurskie",503355.0,11500,2 pokoje,43.77,Inwestycja deweloperska,/pl/oferta/warszawska99-mieszkanie-2-pok-14-ID4ntXS,"43,77 m²",pełna własność,2,do wykończenia,2/6,Zapytaj,Zapytaj,garaż/miejsce parkingowe,Zapytaj,inne,inne,inne,inne,inne,inne,inne,inne,inne,inne,inne,inne,inne,2024-01-16,"Aleja Warszawska, Kortowo, Olsztyn, warmińsko-mazurskie",20.4590993,53.7463036
2w1 Mieszkanie i Lokal,"Mieszkanie na sprzedaż: Kormoran, Olsztyn, warmińsko-mazurskie",619000.0,8145,3 pokoje,76.0,Biuro nieruchomości,/pl/oferta/2w1-mieszkanie-i-lokal-ID4nXS3,76 m²,Zapytaj,3,Zapytaj,1/1,Zapytaj,Zapytaj,Zapytaj,Zapytaj,Zapytaj,wtórny,biuro nieruchomości ,brak informacji,brak informacji,brak informacji,brak informacji,nie,brak informacji,brak informacji,brak informacji,brak informacji,brak informacji,2024-01-16,"Kormoran, Olsztyn, warmińsko-mazurskie",20.498350881402075,53.7685685
Mieszkanie do remontu Zatorze- Rezerwacja,"Mieszkanie na sprzedaż: ul. Poprzeczna, Podleśna, Olsztyn, warmińsko-mazurskie",375000.0,5494,3 pokoje,68.26,Biuro nieruchomości,/pl/oferta/mieszkanie-do-remontu-zatorze-rezerwacja-ID4nXu0,"68,26 m²",pełna własność,3,Zapytaj,parter/2,Zapytaj,Zapytaj,Zapytaj,Zapytaj,Zapytaj,wtórny,biuro nieruchomości ,brak informacji,1960,blok,brak informacji,nie,brak informacji,teren zamknięty,brak informacji,"piwnica, oddzielna kuchnia",cegła,2024-01-16,"Poprzeczna, Podleśna, Olsztyn, warmińsko-mazurskie",20.5045712,53.7921505
Mieszkanie gotowe do wprowadzenia,"Mieszkanie na sprzedaż: ul. gen. Franciszka Kleeberga, Osiedle Generałów, Olsztyn, warmińsko-mazurskie",549000.0,7111,4 pokoje,77.2,Biuro nieruchomości,/pl/oferta/mieszkanie-gotowe-do-wprowadzenia-ID4nXmU,"77,2 m²",Zapytaj,4,do zamieszkania,3/4,balkon,Zapytaj,Zapytaj,Zapytaj,miejskie,wtórny,biuro nieruchomości ,brak informacji,1989,blok,brak informacji,nie,brak informacji,brak informacji,brak informacji,"piwnica, oddzielna kuchnia, pom. użytkowe",wielka płyta,2024-01-16,"gen. Franciszka Kleeberga, Osiedle Generałów, Olsztyn, warmińsko-mazurskie",20.4792157,53.7424514
Warszawska99 | mieszkanie 2-pok. | 47,"Mieszkanie na sprzedaż: al. Aleja Warszawska, Kortowo, Olsztyn, warmińsko-mazurskie",552920.0,11500,2 pokoje,48.08,Inwestycja deweloperska,/pl/oferta/warszawska99-mieszkanie-2-pok-47-ID4nu1r,"48,08 m²",pełna własność,2,do wykończenia,2/6,Zapytaj,Zapytaj,garaż/miejsce parkingowe,Zapytaj,inne,inne,inne,inne,inne,inne,inne,inne,inne,inne,inne,inne,inne,2024-01-16,"Aleja Warszawska, Kortowo, Olsztyn, warmińsko-mazurskie",20.4572414,53.7433539
"3 pokoje,Limanowskiego,61m2,369000zł.,negocjacje","Mieszkanie na sprzedaż: Zatorze, Olsztyn, warmińsko-mazurskie",369000.0,6049,3 pokoje,61.0,Biuro nieruchomości,/pl/oferta/3-pokoje-limanowskiego-61m2-369000zl-negocjacje-ID4nVq6,61 m²,pełna własność,3,do zamieszkania,2/3,Zapytaj,Zapytaj,Zapytaj,Zapytaj,miejskie,wtórny,biuro nieruchomości ,brak informacji,brak informacji,blok,plastikowe,nie,brak informacji,brak informacji,brak informacji,brak informacji,cegła,2024-01-16,"Zatorze, Olsztyn, warmińsko-mazurskie",20.488316039989876,53.78846295
Apartamenty wakacyjne nad jeziorem Ukiel,"Mieszkanie na sprzedaż: ul. Sielska, Dajtki, Olsztyn, warmińsko-mazurskie",396330.0,11000,2 pokoje,36.03,Biuro nieruchomości,/pl/oferta/apartamenty-wakacyjne-nad-jeziorem-ukiel-ID4fvHW,"36,03 m²",pełna własność,2,do wykończenia,parter/2,Zapytaj,Zapytaj,garaż/miejsce parkingowe,Zapytaj,inne,pierwotny,biuro nieruchomości ,brak informacji,2024,apartamentowiec,aluminiowe,tak,"telewizja kablowa, internet",system alarmowy,brak informacji,klimatyzacja,inny,2024-01-16,"Sielska, Dajtki, Olsztyn, warmińsko-mazurskie",20.4322208,53.7692786
Apartamenty Wyzwolenia | apartament nr 34,"Mieszkanie na sprzedaż: ul. Wyzwolenia, Śródmieście, Olsztyn, warmińsko-mazurskie",554838.0,9300,3 pokoje,59.66,Inwestycja deweloperska,/pl/oferta/apartamenty-wyzwolenia-apartament-nr-34-ID4chH7,"59,66 m²",pełna własność,3,do wykończenia,3/7,"ogródek, taras",Zapytaj,garaż/miejsce parkingowe,tak,miejskie,miejskie,miejskie,miejskie,miejskie,miejskie,miejskie,miejskie,miejskie,miejskie,miejskie,miejskie,miejskie,2024-01-16,"Wyzwolenia, Śródmieście, Olsztyn, warmińsko-mazurskie",20.4781084,53.7788089
"Osiedle Versal, 2 pok. 50,6 m2, 5p z klimatyzacją","Mieszkanie na sprzedaż: ul. Armii Krajowej, Osiedle Grunwaldzkie, Olsztyn, warmińsko-mazurskie",595000.0,12045,2 pokoje,49.4,Biuro nieruchomości,/pl/oferta/osiedle-versal-2-pok-50-6-m2-5p-z-klimatyzacja-ID4nWSe,"49,4 m²",pełna własność,2,do zamieszkania,5/7,balkon,560 zł,Zapytaj,Zapytaj,miejskie,wtórny,biuro nieruchomości ,2023-11-18,2013,blok,plastikowe,tak,"telewizja kablowa, internet",system alarmowy,"zmywarka, lodówka, meble, piekarnik, kuchenka","klimatyzacja, oddzielna kuchnia",cegła,2024-01-16,"Armii Krajowej, Osiedle Grunwaldzkie, Olsztyn, warmińsko-mazurskie",20.4542161,53.7744105
A.58 2-pokojowy apartament przy jeziorze Ukiel,"Mieszkanie na sprzedaż: ul. Sielska, Dajtki, Olsztyn, warmińsko-mazurskie",687570.0,18832,2 pokoje,36.51,Inwestycja deweloperska,/pl/oferta/a-58-2-pokojowy-apartament-przy-jeziorze-ukiel-ID4kXTb,"36,51 m²",pełna własność,2,do wykończenia,2/2,balkon,Zapytaj,Zapytaj,Zapytaj,Zapytaj,pierwotny,deweloper,brak informacji,2024,apartamentowiec,plastikowe,nie,"telewizja kablowa, internet","teren zamknięty, domofon / wideofon",brak informacji,brak informacji,brak informacji,2024-01-16,"Sielska, Dajtki, Olsztyn, warmińsko-mazurskie",20.4322208,53.7692786
Warszawska99 | mieszkanie 3-pok. | 26,"Mieszkanie na sprzedaż: al. Aleja Warszawska, Kortowo, Olsztyn, warmińsko-mazurskie",655992.0,10800,3 pokoje,60.74,Inwestycja deweloperska,/pl/oferta/warszawska99-mieszkanie-3-pok-26-ID4nu3W,"60,74 m²",pełna własność,3,do wykończenia,3/6,balkon,Zapytaj,garaż/miejsce parkingowe,Zapytaj,inne,inne,inne,inne,inne,inne,inne,inne,inne,inne,inne,inne,inne,2024-01-16,"Aleja Warszawska, Kortowo, Olsztyn, warmińsko-mazurskie",20.4572414,53.7433539
REZERWACJA mieszkanie 2,"Mieszkanie na sprzedaż: ul. Wojciecha Kętrzyńskiego, Osiedle Kętrzyńskiego, Olsztyn, warmińsko-mazurskie",420235.5,8430,3 pokoje,49.85,Inwestycja deweloperska,/pl/oferta/rezerwacja-mieszkanie-2-ID4eY0n,"49,85 m²",pełna własność,3,do wykończenia,parter/4,taras,Zapytaj,garaż/miejsce parkingowe,tak,miejskie,pierwotny,deweloper,brak informacji,2023,blok,plastikowe,tak,"telewizja kablowa, internet, telefon","drzwi / okna antywłamaniowe, domofon / wideofon",brak informacji,brak informacji,brak informacji,2024-01-16,"Wojciecha Kętrzyńskiego, Osiedle Kętrzyńskiego, Olsztyn, warmińsko-mazurskie",20.4943042,53.7827514
A.34 2-pokojowy apartament przy jeziorze Ukiel,"Mieszkanie na sprzedaż: ul. Sielska, Dajtki, Olsztyn, warmińsko-mazurskie",687570.0,18832,2 pokoje,36.51,Inwestycja deweloperska,/pl/oferta/a-34-2-pokojowy-apartament-przy-jeziorze-ukiel-ID4kXT6,"36,51 m²",pełna własność,2,do wykończenia,1/2,balkon,Zapytaj,Zapytaj,Zapytaj,Zapytaj,pierwotny,deweloper,brak informacji,2024,apartamentowiec,plastikowe,nie,"telewizja kablowa, internet","teren zamknięty, domofon / wideofon",brak informacji,brak informacji,brak informacji,2024-01-16,"Sielska, Dajtki, Olsztyn, warmińsko-mazurskie",20.4322208,53.7692786
Villa Symfonia | Olsztyn | M28,"Mieszkanie na sprzedaż: ul. Wojciecha Kętrzyńskiego, Osiedle Kętrzyńskiego, Olsztyn, warmińsko-mazurskie",678193.0,8300,4 pokoje,81.71,Inwestycja deweloperska,/pl/oferta/villa-symfonia-olsztyn-m28-ID4eTH9,"81,71 m²",pełna własność,4,do wykończenia,3/4,balkon,Zapytaj,garaż/miejsce parkingowe,tak,miejskie,pierwotny,deweloper,brak informacji,2023,blok,plastikowe,tak,"telewizja kablowa, internet","drzwi / okna antywłamaniowe, domofon / wideofon",brak informacji,"dwupoziomowe, pom. użytkowe",cegła,2024-01-16,"Wojciecha Kętrzyńskiego, Osiedle Kętrzyńskiego, Olsztyn, warmińsko-mazurskie",20.4943042,53.7827514
Villa Symfonia | Olsztyn | mieszkanie M23,"Mieszkanie na sprzedaż: ul. Wojciecha Kętrzyńskiego, Osiedle Kętrzyńskiego, Olsztyn, warmińsko-mazurskie",661759.0,8300,5 pokoi,79.73,Inwestycja deweloperska,/pl/oferta/villa-symfonia-olsztyn-mieszkanie-m23-ID4eY1v,"79,73 m²",pełna własność,5,do wykończenia,3/4,balkon,Zapytaj,garaż/miejsce parkingowe,tak,miejskie,pierwotny,deweloper,brak informacji,2023,blok,plastikowe,tak,"telewizja kablowa, internet, telefon","drzwi / okna antywłamaniowe, domofon / wideofon",brak informacji,"dwupoziomowe, pom. użytkowe",cegła,2024-01-16,"Wojciecha Kętrzyńskiego, Osiedle Kętrzyńskiego, Olsztyn, warmińsko-mazurskie",20.4943042,53.7827514
A.61 2-pokojowy apartament przy jeziorze Ukiel,"Mieszkanie na sprzedaż: ul. Sielska, Dajtki, Olsztyn, warmińsko-mazurskie",687570.0,18832,2 pokoje,36.51,Inwestycja deweloperska,/pl/oferta/a-61-2-pokojowy-apartament-przy-jeziorze-ukiel-ID4kXSY,"36,51 m²",pełna własność,2,do wykończenia,2/2,balkon,Zapytaj,Zapytaj,Zapytaj,Zapytaj,pierwotny,deweloper,brak informacji,2024,apartamentowiec,plastikowe,nie,"telewizja kablowa, internet","teren zamknięty, domofon / wideofon",brak informacji,brak informacji,brak informacji,2024-01-16,"Sielska, Dajtki, Olsztyn, warmińsko-mazurskie",20.4322208,53.7692786
"Mieszkanie z Panoramą Miasta, ul. Jagiellońska","Mieszkanie na sprzedaż: Zatorze, Olsztyn, warmińsko-mazurskie",387000.0,7140,2 pokoje,54.2,Biuro nieruchomości,/pl/oferta/mieszkanie-z-panorama-miasta-ul-jagiellonska-ID4nTgf,"54,2 m²",pełna własność,2,do zamieszkania,10/10,Zapytaj,Zapytaj,garaż/miejsce parkingowe,Zapytaj,miejskie,wtórny,biuro nieruchomości ,brak informacji,brak informacji,blok,plastikowe,tak,brak informacji,"system alarmowy, monitoring / ochrona, domofon / wideofon","meble, lodówka, zmywarka",brak informacji,cegła,2024-01-16,"Zatorze, Olsztyn, warmińsko-mazurskie",20.488316039989876,53.78846295
Mieszkanie 50 m2 w centrum miasta,"Mieszkanie na sprzedaż: ul. Niepodległości, Osiedle Kościuszki, Olsztyn, warmińsko-mazurskie",429000.0,8517,2 pokoje,50.37,Biuro nieruchomości,/pl/oferta/mieszkanie-50-m2-w-centrum-miasta-ID4nIjR,"50,37 m²",pełna własność,2,Zapytaj,parter,Zapytaj,440 zł,Zapytaj,Zapytaj,Zapytaj,wtórny,biuro nieruchomości ,brak informacji,brak informacji,brak informacji,brak informacji,nie,brak informacji,brak informacji,brak informacji,brak informacji,brak informacji,2024-01-16,"Niepodległości, Osiedle Kościuszki, Olsztyn, warmińsko-mazurskie",20.4826464,53.7682694
A.36 Apartament przy plaży jeziora Ukiel,"Mieszkanie na sprzedaż: ul. Sielska, Dajtki, Olsztyn, warmińsko-mazurskie",687570.0,18832,2 pokoje,36.51,Inwestycja deweloperska,/pl/oferta/a-36-apartament-przy-plazy-jeziora-ukiel-ID4kXSS,"36,51 m²",pełna własność,2,do wykończenia,1/2,balkon,Zapytaj,Zapytaj,Zapytaj,Zapytaj,pierwotny,deweloper,brak informacji,2024,apartamentowiec,plastikowe,nie,"telewizja kablowa, internet","teren zamknięty, domofon / wideofon",brak informacji,brak informacji,brak informacji,2024-01-16,"Sielska, Dajtki, Olsztyn, warmińsko-mazurskie",20.4322208,53.7692786
"Duże, nowoczesne mieszkanie z ogródkiem","Mieszkanie na sprzedaż: ul. Żurawia, Gutkowo, Olsztyn, warmińsko-mazurskie",849000.0,9123,4 pokoje,93.06,Biuro nieruchomości,/pl/oferta/duze-nowoczesne-mieszkanie-z-ogrodkiem-ID4nSB0,"93,06 m²",pełna własność,4,do zamieszkania,Zapytaj,ogródek,Zapytaj,garaż/miejsce parkingowe,Zapytaj,gazowe,wtórny,biuro nieruchomości ,brak informacji,2018,blok,brak informacji,nie,brak informacji,brak informacji,brak informacji,brak informacji,brak informacji,2024-01-16,"Żurawia, Gutkowo, Olsztyn, warmińsko-mazurskie",20.3830838,53.7890688
"Osiedle Belweder, 3 pokoje na parterze.","Mieszkanie na sprzedaż: Śródmieście, Olsztyn, warmińsko-mazurskie",500000.0,9615,3 pokoje,52.0,Biuro nieruchomości,/pl/oferta/osiedle-belweder-3-pokoje-na-parterze-ID4nSu9,52 m²,Zapytaj,3,Zapytaj,parter/3,Zapytaj,470 zł,Zapytaj,Zapytaj,Zapytaj,wtórny,biuro nieruchomości ,brak informacji,brak informacji,brak informacji,brak informacji,nie,brak informacji,brak informacji,brak informacji,brak informacji,brak informacji,2024-01-16,"Śródmieście, Olsztyn, warmińsko-mazurskie",20.479841247382936,53.777882700000006
"3 pokoje+jadalnia, mieszkanie(74,9 m2)ul.Jaroszyka","Mieszkanie na sprzedaż: ul. Kazimierza Jaroszyka, Jaroty, Olsztyn, warmińsko-mazurskie",550000.0,7343,4 pokoje,74.9,Biuro nieruchomości,/pl/oferta/3-pokoje-jadalnia-mieszkanie74-9-m2ul-jaroszyka-ID4nRSs,"74,9 m²",pełna własność,4,do zamieszkania,4/4,balkon,980 zł,garaż/miejsce parkingowe,Zapytaj,Zapytaj,wtórny,biuro nieruchomości ,2023-12-31,1995,brak informacji,drewniane,nie,brak informacji,brak informacji,"lodówka, meble, piekarnik, kuchenka, pralka",piwnica,brak informacji,2024-01-16,"Kazimierza Jaroszyka, Jaroty, Olsztyn, warmińsko-mazurskie",20.4897942,53.7416417
"""Nowe Zatorze"" 4 pokoje + 2msc garażowe + piwnica","Mieszkanie na sprzedaż: ul. Marii Zientary-Malewskiej, Zielona Górka, Olsztyn, warmińsko-mazurskie",805000.0,11457,4 pokoje,70.26,Biuro nieruchomości,/pl/oferta/nowe-zatorze-4-pokoje-2msc-garazowe-piwnica-ID4nsid,"70,26 m²",pełna własność,4,do zamieszkania,3/5,balkon,700 zł,garaż/miejsce parkingowe,Zapytaj,miejskie,wtórny,biuro nieruchomości ,brak informacji,2022,blok,plastikowe,nie,"telewizja kablowa, internet, telefon","drzwi / okna antywłamaniowe, teren zamknięty, domofon / wideofon","zmywarka, lodówka, meble, piekarnik, kuchenka",piwnica,pustak,2024-01-16,"Marii Zientary-Malewskiej, Zielona Górka, Olsztyn, warmińsko-mazurskie",20.553949,53.80116
Villa Symfonia | Olsztyn | mieszkanie M47,"Mieszkanie na sprzedaż: ul. Wojciecha Kętrzyńskiego, Osiedle Kętrzyńskiego, Olsztyn, warmińsko-mazurskie",652050.0,8280,4 pokoje,78.75,Inwestycja deweloperska,/pl/oferta/villa-symfonia-olsztyn-mieszkanie-m47-ID4eY2q,"78,75 m²",pełna własność,4,do wykończenia,3/4,balkon,Zapytaj,garaż/miejsce parkingowe,tak,miejskie,pierwotny,deweloper,brak informacji,2023,blok,plastikowe,tak,"telewizja kablowa, internet, telefon","drzwi / okna antywłamaniowe, domofon / wideofon",brak informacji,"dwupoziomowe, pom. użytkowe",cegła,2024-01-16,"Wojciecha Kętrzyńskiego, Osiedle Kętrzyńskiego, Olsztyn, warmińsko-mazurskie",20.4943042,53.7827514
Wyspiańskiego - w promieniach centrum,"Mieszkanie na sprzedaż: Osiedle Wojska Polskiego, Olsztyn, warmińsko-mazurskie",548796.0,12450,2 pokoje,44.08,Biuro nieruchomości,/pl/oferta/wyspianskiego-w-promieniach-centrum-ID4hoCA,"44,08 m²",pełna własność,2,do wykończenia,parter/3,"balkon, taras",Zapytaj,garaż/miejsce parkingowe,tak,miejskie,pierwotny,biuro nieruchomości ,brak informacji,2024,blok,brak informacji,tak,brak informacji,domofon / wideofon,brak informacji,brak informacji,silikat,2024-01-16,"Osiedle Wojska Polskiego, Olsztyn, warmińsko-mazurskie",20.481134,53.7946642
Wyspiańskiego - w promieniach centrum,"Mieszkanie na sprzedaż: Osiedle Wojska Polskiego, Olsztyn, warmińsko-mazurskie",759600.0,12000,3 pokoje,63.3,Biuro nieruchomości,/pl/oferta/wyspianskiego-w-promieniach-centrum-ID4iu9B,"63,3 m²",Zapytaj,3,do wykończenia,parter/3,"balkon, taras",Zapytaj,garaż/miejsce parkingowe,Zapytaj,miejskie,pierwotny,biuro nieruchomości ,brak informacji,2024,apartamentowiec,brak informacji,tak,"telewizja kablowa, internet, telefon","teren zamknięty, domofon / wideofon",brak informacji,brak informacji,silikat,2024-01-16,"Osiedle Wojska Polskiego, Olsztyn, warmińsko-mazurskie",20.481134,53.7946642
Wyspiańskiego - w promieniach centrum,"Mieszkanie na sprzedaż: Osiedle Wojska Polskiego, Olsztyn, warmińsko-mazurskie",1948660.0,14000,5 pokoi,139.19,Biuro nieruchomości,/pl/oferta/wyspianskiego-w-promieniach-centrum-ID4iu9y,"139,19 m²",pełna własność,5,do wykończenia,3/3,"balkon, taras",Zapytaj,garaż/miejsce parkingowe,Zapytaj,miejskie,pierwotny,biuro nieruchomości ,brak informacji,2024,apartamentowiec,brak informacji,tak,"telewizja kablowa, internet, telefon","teren zamknięty, domofon / wideofon",brak informacji,brak informacji,silikat,2024-01-16,"Osiedle Wojska Polskiego, Olsztyn, warmińsko-mazurskie",20.481134,53.7946642
Apartament Wyspiańskiego- wykończony,"Mieszkanie na sprzedaż: Osiedle Wojska Polskiego, Olsztyn, warmińsko-mazurskie",993810.0,15700,3 pokoje,63.3,Biuro nieruchomości,/pl/oferta/apartament-wyspianskiego-wykonczony-ID4iu9t,"63,3 m²",Zapytaj,3,do zamieszkania,1/3,"balkon, taras",Zapytaj,garaż/miejsce parkingowe,Zapytaj,miejskie,pierwotny,biuro nieruchomości ,brak informacji,2024,apartamentowiec,brak informacji,tak,"telewizja kablowa, internet, telefon","teren zamknięty, domofon / wideofon",brak informacji,brak informacji,silikat,2024-01-16,"Osiedle Wojska Polskiego, Olsztyn, warmińsko-mazurskie",20.481134,53.7946642
3 pokojowe parter ul. Radiowa w Olsztynie,"Mieszkanie na sprzedaż: ul. Radiowa, Osiedle Wojska Polskiego, Olsztyn, warmińsko-mazurskie",315000.0,6954,3 pokoje,45.3,Biuro nieruchomości,/pl/oferta/3-pokojowe-parter-ul-radiowa-w-olsztynie-ID4nQy4,"45,3 m²",pełna własność,3,do remontu,parter/2,Zapytaj,550 zł,Zapytaj,Zapytaj,miejskie,wtórny,biuro nieruchomości ,brak informacji,brak informacji,blok,plastikowe,nie,telewizja kablowa,domofon / wideofon,kuchenka,"piwnica, oddzielna kuchnia",cegła,2024-01-16,"Radiowa, Osiedle Wojska Polskiego, Olsztyn, warmińsko-mazurskie",,
"Mieszkanie 3 pokoje, duża loggia!","Mieszkanie na sprzedaż: ul. Poprzeczna, Podleśna, Olsztyn, warmińsko-mazurskie",629000.0,10412,3 pokoje,60.41,Biuro nieruchomości,/pl/oferta/mieszkanie-3-pokoje-duza-loggia-ID4nQaO,"60,41 m²",pełna własność,3,do zamieszkania,5/9,balkon,400 zł,Zapytaj,Zapytaj,miejskie,wtórny,biuro nieruchomości ,brak informacji,2023,apartamentowiec,brak informacji,nie,brak informacji,domofon / wideofon,"meble, lodówka, zmywarka",brak informacji,brak informacji,2024-01-16,"Poprzeczna, Podleśna, Olsztyn, warmińsko-mazurskie",20.508319,53.7911469
3 pokoje na Starym Mieście,"Mieszkanie na sprzedaż: Śródmieście, Olsztyn, warmińsko-mazurskie",490000.0,7992,3 pokoje,61.31,Biuro nieruchomości,/pl/oferta/3-pokoje-na-starym-miescie-ID4nPU4,"61,31 m²",pełna własność,3,Zapytaj,2/2,Zapytaj,Zapytaj,Zapytaj,Zapytaj,miejskie,wtórny,biuro nieruchomości ,brak informacji,1957,kamienica,plastikowe,nie,brak informacji,brak informacji,brak informacji,brak informacji,cegła,2024-01-16,"Śródmieście, Olsztyn, warmińsko-mazurskie",20.479841247382936,53.777882700000006
"Duże 3 pokojowe mieszkanie, Nagórki!","Mieszkanie na sprzedaż: ul. Franciszka Barcza, Nagórki, Olsztyn, warmińsko-mazurskie",749000.0,10624,3 pokoje,70.5,Biuro nieruchomości,/pl/oferta/duze-3-pokojowe-mieszkanie-nagorki-ID4noFh,"70,5 m²",pełna własność,3,do zamieszkania,1/6,balkon,Zapytaj,garaż/miejsce parkingowe,Zapytaj,miejskie,wtórny,biuro nieruchomości ,2023-11-01,2019,blok,brak informacji,tak,brak informacji,domofon / wideofon,"meble, lodówka, zmywarka",brak informacji,pustak,2024-01-16,"Franciszka Barcza, Nagórki, Olsztyn, warmińsko-mazurskie",20.5040556,53.7497739
Nowe budownictwo - Gutkowo - 3 pok,"Mieszkanie na sprzedaż: ul. Żurawia, Gutkowo, Olsztyn, warmińsko-mazurskie",629000.0,9787,3 pokoje,64.27,Biuro nieruchomości,/pl/oferta/nowe-budownictwo-gutkowo-3-pok-ID4nPmV,"64,27 m²",pełna własność,3,do zamieszkania,2/2,balkon,670 zł,Zapytaj,Zapytaj,Zapytaj,wtórny,biuro nieruchomości ,2023-12-29,2017,blok,brak informacji,nie,brak informacji,monitoring / ochrona,meble,"piwnica, pom. użytkowe",silikat,2024-01-16,"Żurawia, Gutkowo, Olsztyn, warmińsko-mazurskie",20.3830838,53.7890688
Mieszkanie Z Miejscem Postojowym Ul.Barcza 50J,"Mieszkanie na sprzedaż: Jaroty, Olsztyn, warmińsko-mazurskie",729000.0,9979,4 pokoje,73.05,Biuro nieruchomości,/pl/oferta/mieszkanie-z-miejscem-postojowym-ul-barcza-50j-ID4mPQK,"73,05 m²",Zapytaj,4,do wykończenia,6,balkon,Zapytaj,garaż/miejsce parkingowe,Zapytaj,Zapytaj,wtórny,biuro nieruchomości ,brak informacji,2023,brak informacji,brak informacji,tak,brak informacji,brak informacji,brak informacji,brak informacji,brak informacji,2024-01-16,"Jaroty, Olsztyn, warmińsko-mazurskie",20.497921309754368,53.74069325
"Jonkowo, ul.Spacerowa 34, 47m2, 2pok. Ip, balkon","Mieszkanie na sprzedaż: ul. Spacerowa, Śródmieście, Olsztyn, warmińsko-mazurskie",299000.0,6362,2 pokoje,47.0,Biuro nieruchomości,/pl/oferta/jonkowo-ul-spacerowa-34-47m2-2pok-ip-balkon-ID4nOZV,47 m²,Zapytaj,2,Zapytaj,1/2,Zapytaj,Zapytaj,Zapytaj,Zapytaj,Zapytaj,wtórny,biuro nieruchomości ,2023-11-06,brak informacji,brak informacji,brak informacji,nie,brak informacji,brak informacji,brak informacji,brak informacji,brak informacji,2024-01-16,"Spacerowa, Śródmieście, Olsztyn, warmińsko-mazurskie",,
Funkcjonalne mieszkanie w otoczeniu zieleni,"Mieszkanie na sprzedaż: ul. Konstantego Ildefonsa Gałczyńskiego, Podgrodzie, Olsztyn, warmińsko-mazurskie",380000.0,7867,3 pokoje,48.3,Biuro nieruchomości,/pl/oferta/funkcjonalne-mieszkanie-w-otoczeniu-zieleni-ID4lDoa,"48,3 m²",pełna własność,3,do remontu,parter/4,balkon,680 zł,garaż/miejsce parkingowe,Film,miejskie,wtórny,biuro nieruchomości ,brak informacji,1975,blok,brak informacji,nie,"telewizja kablowa, internet",brak informacji,meble,"piwnica, oddzielna kuchnia",wielka płyta,2024-01-16,"Konstantego Ildefonsa Gałczyńskiego, Podgrodzie, Olsztyn, warmińsko-mazurskie",20.4683142,53.7657484
"Rezerwacja! Przestronne M-3, ul. Bilitewskiego!!!","Mieszkanie na sprzedaż: ul. ks. Roberta Bilitewskiego, Osiedle Generałów, Olsztyn, warmińsko-mazurskie",479000.0,9663,2 pokoje,49.57,Biuro nieruchomości,/pl/oferta/rezerwacja-przestronne-m-3-ul-bilitewskiego-ID4nOOq,"49,57 m²",pełna własność,2,do zamieszkania,3/6,balkon,"388,90 zł",Zapytaj,Zapytaj,miejskie,wtórny,biuro nieruchomości ,brak informacji,2013,apartamentowiec,plastikowe,tak,brak informacji,domofon / wideofon,brak informacji,"piwnica, oddzielna kuchnia",cegła,2024-01-16,"ks. Roberta Bilitewskiego, Osiedle Generałów, Olsztyn, warmińsko-mazurskie",20.4757163,53.7378771
Kawalerka gotowa do zamieszkania lub wynajmu!,"Mieszkanie na sprzedaż: ul. Marii Zientary-Malewskiej, Osiedle Kętrzyńskiego, Olsztyn, warmińsko-mazurskie",270000.0,7337,1 pokój,36.8,Biuro nieruchomości,/pl/oferta/kawalerka-gotowa-do-zamieszkania-lub-wynajmu-ID4nOsS,"36,8 m²",pełna własność,1,do zamieszkania,3/3,Zapytaj,Zapytaj,Zapytaj,Zapytaj,Zapytaj,wtórny,biuro nieruchomości ,brak informacji,1900,kamienica,brak informacji,nie,brak informacji,brak informacji,brak informacji,"piwnica, pom. użytkowe",cegła,2024-01-16,"Marii Zientary-Malewskiej, Osiedle Kętrzyńskiego, Olsztyn, warmińsko-mazurskie",20.4979891,53.7882743
Oferta inwestycyjna – doskonała lokalizacja,"Mieszkanie na sprzedaż: ul. Franciszka Barcza, Nagórki, Olsztyn, warmińsko-mazurskie",425000.0,6372,4 pokoje,66.7,Biuro nieruchomości,/pl/oferta/oferta-inwestycyjna-doskonala-lokalizacja-ID4nNKH,"66,7 m²",pełna własność,4,do zamieszkania,3/3,Zapytaj,770 zł,Zapytaj,Zapytaj,miejskie,wtórny,biuro nieruchomości ,brak informacji,1986,blok,plastikowe,nie,"telewizja kablowa, internet",domofon / wideofon,meble,"piwnica, oddzielna kuchnia",cegła,2024-01-16,"Franciszka Barcza, Nagórki, Olsztyn, warmińsko-mazurskie",20.5040556,53.7497739
