free_text,address,price,price_meter,rooms,area,more,add_link,Powierzchnia,Forma własności,Liczba pokoi,Stan wykończenia,Piętro,Balkon / ogród / taras,Czynsz,Miejsce parkingowe,Obsługa zdalna,Ogrzewanie,Rynek,Typ ogłoszeniodawcy,Dostępne od,Rok budowy,Rodzaj zabudowy,Okna,Winda,Media,Zabezpieczenia,Wyposażenie,Informacje dodatkowe,Materiał budynku,scraping_date,address_new,Longitude,Latitude
Mieszkanie z balkonem i strychem - ul. Kiemliczów,"Mieszkanie na sprzedaż: Gutkowo, Olsztyn, warmińsko-mazurskie",560000.0,7000,3 pokoje,80.0,Inwestycja deweloperska,/pl/oferta/mieszkanie-z-balkonem-i-strychem-ul-kiemliczow-ID4o6uS,80 m²,pełna własność,3,do wykończenia,1/1,balkon,Zapytaj,garaż/miejsce parkingowe,Zapytaj,gazowe,pierwotny,deweloper,brak informacji,2025,apartamentowiec,plastikowe,nie,internet,"system alarmowy, teren zamknięty",brak informacji,pom. użytkowe,beton komórkowy,2024-01-16,"Gutkowo, Olsztyn, warmińsko-mazurskie",20.400654230051003,53.7997465
A.12 2-pokojowy apartament przy jeziorze Ukiel,"Mieszkanie na sprzedaż: ul. Sielska, Dajtki, Olsztyn, warmińsko-mazurskie",675270.0,18495,2 pokoje,36.51,Inwestycja deweloperska,/pl/oferta/a-12-2-pokojowy-apartament-przy-jeziorze-ukiel-ID4nxui,"36,51 m²",pełna własność,2,do wykończenia,parter/2,"ogródek, taras",Zapytaj,Zapytaj,Zapytaj,Zapytaj,pierwotny,deweloper,brak informacji,2024,apartamentowiec,plastikowe,nie,"telewizja kablowa, internet","teren zamknięty, domofon / wideofon",brak informacji,brak informacji,brak informacji,2024-01-16,"Sielska, Dajtki, Olsztyn, warmińsko-mazurskie",20.4365504,53.7698795
UMOWA PRZEDWSTĘPNA - 2 pokoje nad Jeziorem Długim,"Mieszkanie na sprzedaż: ul. Leśna, Osiedle Nad Jeziorem Długim, Olsztyn, warmińsko-mazurskie",455000.0,12405,2 pokoje,36.68,"36,68 m²",/pl/oferta/umowa-przedwstepna-2-pokoje-nad-jeziorem-dlugim-ID4o5xT,"36,68 m²",pełna własność,2,do zamieszkania,4/5,balkon,550 zł,garaż/miejsce parkingowe,Zapytaj,miejskie,wtórny,prywatny,brak informacji,2010,blok,drewniane,tak,internet,"drzwi / okna antywłamaniowe, domofon / wideofon","zmywarka, lodówka, meble, piekarnik, kuchenka, telewizor, pralka",piwnica,cegła,2024-01-16,"Leśna, Osiedle Nad Jeziorem Długim, Olsztyn, warmińsko-mazurskie",20.4652774,53.7781508
"Mieszkanie, 3 pokoje, Olsztyn, osiedle Podleśna","Mieszkanie na sprzedaż: ul. Chełmińska, Podleśna, Olsztyn, warmińsko-mazurskie",420000.0,6462,3 pokoje,65.0,65 m²,/pl/oferta/mieszkanie-3-pokoje-olsztyn-osiedle-podlesna-ID4od8M,65 m²,spółdzielcze wł. prawo do lokalu,3,do zamieszkania,2/2,balkon,Zapytaj,Zapytaj,tak,miejskie,wtórny,prywatny,brak informacji,1986,blok,plastikowe,nie,"telewizja kablowa, internet, telefon",domofon / wideofon,brak informacji,"piwnica, oddzielna kuchnia",wielka płyta,2024-01-16,"Chełmińska, Podleśna, Olsztyn, warmińsko-mazurskie",20.4974383,53.7964749
"Małeckiego - duży pokój, kuchnia z oknem, piwnica","Mieszkanie na sprzedaż: ul. Antoniego Małeckiego, Osiedle Wojska Polskiego, Olsztyn, warmińsko-mazurskie",229000.0,8808,1 pokój,26.0,Biuro nieruchomości,/pl/oferta/maleckiego-duzy-pokoj-kuchnia-z-oknem-piwnica-ID4oGdb,26 m²,Zapytaj,1,Zapytaj,4/4,Zapytaj,307 zł,Zapytaj,tak,miejskie,wtórny,biuro nieruchomości ,brak informacji,1,blok,plastikowe,nie,internet,domofon / wideofon,brak informacji,piwnica,wielka płyta,2024-01-16,"Antoniego Małeckiego, Osiedle Wojska Polskiego, Olsztyn, warmińsko-mazurskie",,
Idealne na start! Idealne pod kredyt 2% Dworcowa 9,"Mieszkanie na sprzedaż: ul. Dworcowa, Pojezierze, Olsztyn, warmińsko-mazurskie",319000.0,8368,2 pokoje,38.12,Biuro nieruchomości,/pl/oferta/idealne-na-start-idealne-pod-kredyt-2-dworcowa-9-ID4o7iV,"38,12 m²",pełna własność,2,do zamieszkania,1/4,Zapytaj,400 zł,garaż/miejsce parkingowe,Zapytaj,miejskie,wtórny,biuro nieruchomości ,brak informacji,1955,blok,plastikowe,nie,"telewizja kablowa, internet, telefon",domofon / wideofon,"lodówka, meble, piekarnik, kuchenka, pralka","piwnica, oddzielna kuchnia",cegła,2024-01-16,"Dworcowa, Pojezierze, Olsztyn, warmińsko-mazurskie",20.5008241,53.7801885
Atrakcyjne 2-poziomowe z 3 balkonami-świetny punkt,"Mieszkanie na sprzedaż: ul. Floriana Piotrowskiego, Jaroty, Olsztyn, warmińsko-mazurskie",749000.0,8740,4 pokoje,85.7,Biuro nieruchomości,/pl/oferta/atrakcyjne-2-poziomowe-z-3-balkonami-swietny-punkt-ID4lJgD,"85,7 m²",pełna własność,4,do zamieszkania,3/4,balkon,547 zł,garaż/miejsce parkingowe,Zapytaj,miejskie,wtórny,biuro nieruchomości ,brak informacji,2008,blok,plastikowe,nie,"telewizja kablowa, internet, telefon","drzwi / okna antywłamaniowe, domofon / wideofon","zmywarka, lodówka, meble, piekarnik, kuchenka","piwnica, pom. użytkowe",pustak,2024-01-16,"Floriana Piotrowskiego, Jaroty, Olsztyn, warmińsko-mazurskie",20.49135,53.7395695
"Prestiżowy apartament, wysoki standard, winda","Mieszkanie na sprzedaż: ul. ks. Roberta Bilitewskiego, Osiedle Generałów, Olsztyn, warmińsko-mazurskie",810000.0,11248,3 pokoje,72.01,Biuro nieruchomości,/pl/oferta/prestizowy-apartament-wysoki-standard-winda-ID4oGaj,"72,01 m²",pełna własność,3,do zamieszkania,5/6,balkon,Zapytaj,garaż/miejsce parkingowe,Zapytaj,Zapytaj,wtórny,biuro nieruchomości ,brak informacji,2018,brak informacji,brak informacji,nie,brak informacji,brak informacji,"zmywarka, lodówka, meble, piekarnik, kuchenka, telewizor, pralka",piwnica,brak informacji,2024-01-16,"ks. Roberta Bilitewskiego, Osiedle Generałów, Olsztyn, warmińsko-mazurskie",20.4751569,53.7363218
Mieszkanie Jagiełły Park w Olsztynku!,"Mieszkanie na sprzedaż: Śródmieście, Olsztyn, warmińsko-mazurskie",435000.0,8481,3 pokoje,51.29,"51,29 m²",/pl/oferta/mieszkanie-jagielly-park-w-olsztynku-ID4oyMl,"51,29 m²",pełna własność,3,do zamieszkania,2/2,balkon,300 zł,garaż/miejsce parkingowe,Zapytaj,miejskie,pierwotny,prywatny,brak informacji,2024,blok,plastikowe,nie,brak informacji,teren zamknięty,"zmywarka, lodówka, piekarnik, kuchenka",brak informacji,cegła,2024-01-16,"Śródmieście, Olsztyn, warmińsko-mazurskie",20.479841247382936,53.777882700000006
"Nowe Mieszkanie w Olsztynku! Bez podatku, bez PCC!","Mieszkanie na sprzedaż: Śródmieście, Olsztyn, warmińsko-mazurskie",425000.0,8558,3 pokoje,49.66,"49,66 m²",/pl/oferta/nowe-mieszkanie-w-olsztynku-bez-podatku-bez-pcc-ID4oyLB,"49,66 m²",pełna własność,3,do zamieszkania,1/2,balkon,300 zł,garaż/miejsce parkingowe,Zapytaj,miejskie,pierwotny,prywatny,brak informacji,2023,blok,plastikowe,nie,brak informacji,"teren zamknięty, domofon / wideofon","zmywarka, lodówka, piekarnik, kuchenka",brak informacji,cegła,2024-01-16,"Śródmieście, Olsztyn, warmińsko-mazurskie",20.479841247382936,53.777882700000006
Mieszkanie poddasze gotowe 37m 2 pok Os. Generałów,"Mieszkanie na sprzedaż: ul. ks. Jerzego Popiełuszki, Osiedle Generałów, Olsztyn, warmińsko-mazurskie",440000.0,11927,2 pokoje,36.89,"36,89 m²",/pl/oferta/mieszkanie-poddasze-gotowe-37m-2-pok-os-generalow-ID4o5sY,"36,89 m²",pełna własność,2,do zamieszkania,3/3,"balkon, taras",Zapytaj,Zapytaj,Zapytaj,miejskie,wtórny,prywatny,brak informacji,brak informacji,blok,brak informacji,nie,brak informacji,"drzwi / okna antywłamaniowe, domofon / wideofon",brak informacji,piwnica,brak informacji,2024-01-16,"ks. Jerzego Popiełuszki, Osiedle Generałów, Olsztyn, warmińsko-mazurskie",20.4788259,53.7391123
Mieszkanie 3 pokoje świetna lokalizacja Olsztyn,"Mieszkanie na sprzedaż: ul. Mieczysława Orłowicza 10, Nagórki, Olsztyn, warmińsko-mazurskie",410000.0,6788,3 pokoje,60.4,Biuro nieruchomości,/pl/oferta/mieszkanie-3-pokoje-swietna-lokalizacja-olsztyn-ID4oacl,"60,4 m²",spółdzielcze wł. prawo do lokalu,3,do zamieszkania,2/11,balkon,820 zł,Zapytaj,Wirtualny spacer,miejskie,wtórny,biuro nieruchomości ,brak informacji,1979,blok,plastikowe,tak,"telewizja kablowa, internet, telefon","drzwi / okna antywłamaniowe, domofon / wideofon","zmywarka, lodówka, meble, piekarnik, kuchenka, pralka","piwnica, oddzielna kuchnia",wielka płyta,2024-01-16,"Mieczysława Orłowicza 10, Nagórki, Olsztyn, warmińsko-mazurskie",20.4920315,53.754372599999996
Mieszkanie 3 pokoje Pieczewo Olsztyn,"Mieszkanie na sprzedaż: ul. Władysława Gębika 59, Pieczewo, Olsztyn, warmińsko-mazurskie",549000.0,8318,3 pokoje,66.0,Biuro nieruchomości,/pl/oferta/mieszkanie-3-pokoje-pieczewo-olsztyn-ID4ordK,66 m²,spółdzielcze wł. prawo do lokalu,3,do zamieszkania,2/4,balkon,767 zł,Zapytaj,Wirtualny spacer,miejskie,wtórny,biuro nieruchomości ,brak informacji,1996,blok,plastikowe,nie,"telewizja kablowa, internet, telefon","system alarmowy, domofon / wideofon, rolety antywłamaniowe","lodówka, meble, piekarnik, kuchenka, pralka","piwnica, oddzielna kuchnia",cegła,2024-01-16,"Władysława Gębika 59, Pieczewo, Olsztyn, warmińsko-mazurskie",20.513795092366415,53.7362221
Warszawska99 | mieszkanie 3-pok. | 8,"Mieszkanie na sprzedaż: al. Aleja Warszawska, Kortowo, Olsztyn, warmińsko-mazurskie",655992.0,10800,3 pokoje,60.74,Inwestycja deweloperska,/pl/oferta/warszawska99-mieszkanie-3-pok-8-ID4nu6J,"60,74 m²",pełna własność,3,do wykończenia,1/6,taras,Zapytaj,garaż/miejsce parkingowe,Zapytaj,inne,inne,inne,inne,inne,inne,inne,inne,inne,inne,inne,inne,inne,2024-01-16,"Aleja Warszawska, Kortowo, Olsztyn, warmińsko-mazurskie",20.457657,53.7439958
Sprzedam mieszkanie 2 pokoje 37m2 Olsztyn Dworcowa,"Mieszkanie na sprzedaż: ul. Dworcowa 16, Pojezierze, Olsztyn, warmińsko-mazurskie",330000.0,8871,2 pokoje,37.2,"37,2 m²",/pl/oferta/sprzedam-mieszkanie-2-pokoje-37m2-olsztyn-dworcowa-ID4otJu,"37,2 m²",spółdzielcze wł. prawo do lokalu,2,do zamieszkania,6/9,balkon,295 zł,Zapytaj,Zapytaj,miejskie,wtórny,prywatny,brak informacji,brak informacji,blok,plastikowe,tak,brak informacji,brak informacji,brak informacji,piwnica,brak informacji,2024-01-16,"Dworcowa 16, Pojezierze, Olsztyn, warmińsko-mazurskie",20.498737460057,53.78022935
"42 m2, 2 pokoje, 1 piętro. Witosa. Blisko las","Mieszkanie na sprzedaż: ul. Wincentego Witosa, Jaroty, Olsztyn, warmińsko-mazurskie",394000.0,9570,2 pokoje,41.17,"41,17 m²",/pl/oferta/42-m2-2-pokoje-1-pietro-witosa-blisko-las-ID4oFXf,"41,17 m²",pełna własność,2,do zamieszkania,1/4,balkon,550 zł,Zapytaj,Zapytaj,Zapytaj,wtórny,prywatny,brak informacji,2001,blok,plastikowe,nie,"telewizja kablowa, internet","drzwi / okna antywłamaniowe, domofon / wideofon","zmywarka, lodówka, meble, piekarnik, kuchenka, telewizor, pralka","piwnica, oddzielna kuchnia, pom. użytkowe",silikat,2024-01-16,"Wincentego Witosa, Jaroty, Olsztyn, warmińsko-mazurskie",20.5077298,53.7361808
"Mieszkanie blisko centrum. Antresola, garderoba.","Mieszkanie na sprzedaż: ul. Wojciecha Kętrzyńskiego, Osiedle Kętrzyńskiego, Olsztyn, warmińsko-mazurskie",639000.0,9397,3 pokoje,68.0,68 m²,/pl/oferta/mieszkanie-blisko-centrum-antresola-garderoba-ID4o4P7,68 m²,pełna własność,3,do zamieszkania,3/3,Zapytaj,270 zł,Zapytaj,Zapytaj,gazowe,wtórny,prywatny,brak informacji,1928,kamienica,plastikowe,nie,"telewizja kablowa, internet",domofon / wideofon,"zmywarka, lodówka, meble, piekarnik, kuchenka, pralka",piwnica,cegła,2024-01-16,"Wojciecha Kętrzyńskiego, Osiedle Kętrzyńskiego, Olsztyn, warmińsko-mazurskie",20.4943042,53.7827514
"2-pokojowe mieszkanie z balkonem, Jaroty","Mieszkanie na sprzedaż: ul. Floriana Piotrowskiego, Jaroty, Olsztyn, warmińsko-mazurskie",369000.0,8794,2 pokoje,41.96,Biuro nieruchomości,/pl/oferta/2-pokojowe-mieszkanie-z-balkonem-jaroty-ID4okrw,"41,96 m²",pełna własność,2,do zamieszkania,2/4,balkon,460 zł,Zapytaj,Zapytaj,miejskie,wtórny,biuro nieruchomości ,brak informacji,1996,blok,brak informacji,nie,brak informacji,brak informacji,brak informacji,"piwnica, oddzielna kuchnia, pom. użytkowe",pustak,2024-01-16,"Floriana Piotrowskiego, Jaroty, Olsztyn, warmińsko-mazurskie",20.49135,53.7395695
3 pokojowe mieszkanie po generalnym remoncie!,"Mieszkanie na sprzedaż: ul. Ignacego Paderewskiego, Podleśna, Olsztyn, warmińsko-mazurskie",415000.0,8585,3 pokoje,48.34,"48,34 m²",/pl/oferta/3-pokojowe-mieszkanie-po-generalnym-remoncie-ID4nJgl,"48,34 m²",pełna własność,3,do zamieszkania,2,Zapytaj,Zapytaj,Zapytaj,Zapytaj,Zapytaj,wtórny,prywatny,brak informacji,brak informacji,blok,brak informacji,nie,brak informacji,brak informacji,brak informacji,brak informacji,cegła,2024-01-16,"Ignacego Paderewskiego, Podleśna, Olsztyn, warmińsko-mazurskie",20.4938427,53.7878352
"48,5 m2 -przestronne 2 pokoje z dużym balkonem","Mieszkanie na sprzedaż: ul. Kardynała Stanisława Hozjusza, Redykajny, Olsztyn, warmińsko-mazurskie",429000.0,8845,2 pokoje,48.5,"48,5 m²",/pl/oferta/48-5-m2-przestronne-2-pokoje-z-duzym-balkonem-ID4oy48,"48,5 m²",pełna własność,2,do zamieszkania,2/3,balkon,Zapytaj,Zapytaj,Zapytaj,kotłownia,wtórny,prywatny,brak informacji,1998,blok,plastikowe,nie,brak informacji,brak informacji,brak informacji,brak informacji,inny,2024-01-16,"Kardynała Stanisława Hozjusza, Redykajny, Olsztyn, warmińsko-mazurskie",20.4388763,53.8101247
"Mieszkanie, 35,87 m², Olsztyn","Mieszkanie na sprzedaż: Nagórki, Olsztyn, warmińsko-mazurskie",399000.0,11124,2 pokoje,35.87,Biuro nieruchomości,/pl/oferta/mieszkanie-35-87-m-olsztyn-ID4oFPb,"35,87 m²",Zapytaj,2,Zapytaj,3/6,balkon,351 zł,Zapytaj,Zapytaj,Zapytaj,wtórny,biuro nieruchomości ,brak informacji,2023,brak informacji,brak informacji,tak,brak informacji,brak informacji,brak informacji,brak informacji,brak informacji,2024-01-16,"Nagórki, Olsztyn, warmińsko-mazurskie",20.493272,53.756199
Mieszkanie z ogródkiem Olsztyn ul. Kiemliczów,"Mieszkanie na sprzedaż: Gutkowo, Olsztyn, warmińsko-mazurskie",570000.0,7945,3 pokoje,71.74,Inwestycja deweloperska,/pl/oferta/mieszkanie-z-ogrodkiem-olsztyn-ul-kiemliczow-ID4o6u8,"71,74 m²",pełna własność,3,do wykończenia,parter/1,"ogródek, taras",Zapytaj,garaż/miejsce parkingowe,Zapytaj,gazowe,pierwotny,deweloper,brak informacji,2025,apartamentowiec,plastikowe,nie,internet,"system alarmowy, teren zamknięty",brak informacji,brak informacji,beton komórkowy,2024-01-16,"Gutkowo, Olsztyn, warmińsko-mazurskie",20.400654230051003,53.7997465
A.13 2-pokojowy apartament przy jeziorze Ukiel,"Mieszkanie na sprzedaż: ul. Sielska, Dajtki, Olsztyn, warmińsko-mazurskie",675270.0,18495,2 pokoje,36.51,Inwestycja deweloperska,/pl/oferta/a-13-2-pokojowy-apartament-przy-jeziorze-ukiel-ID4kXSU,"36,51 m²",pełna własność,2,do wykończenia,parter/2,"ogródek, taras",Zapytaj,Zapytaj,Zapytaj,Zapytaj,pierwotny,deweloper,brak informacji,2024,apartamentowiec,plastikowe,nie,"telewizja kablowa, internet","teren zamknięty, domofon / wideofon",brak informacji,brak informacji,brak informacji,2024-01-16,"Sielska, Dajtki, Olsztyn, warmińsko-mazurskie",20.4365504,53.7698795
"3 pokoje, 58 M , 2 p., Kanta, Jaroty","Mieszkanie na sprzedaż: ul. Immanuela Kanta, Jaroty, Olsztyn, warmińsko-mazurskie",489000.0,8388,3 pokoje,58.3,Biuro nieruchomości,/pl/oferta/3-pokoje-58-m-2-p-kanta-jaroty-ID4oFEG,"58,3 m²",pełna własność,3,do zamieszkania,2/4,Zapytaj,700 zł,Zapytaj,Zapytaj,miejskie,wtórny,biuro nieruchomości ,2024-07-01,1994,blok,drewniane,nie,brak informacji,brak informacji,"zmywarka, lodówka, meble, piekarnik, kuchenka, pralka",piwnica,brak informacji,2024-01-16,"Immanuela Kanta, Jaroty, Olsztyn, warmińsko-mazurskie",20.501478,53.7406388
"Mieszkanie Olsztyn-Jaroty 60,2m2, 3 pokoje","Mieszkanie na sprzedaż: ul. Jana Boenigka, Jaroty, Olsztyn, warmińsko-mazurskie",490000.0,8140,3 pokoje,60.2,"60,2 m²",/pl/oferta/mieszkanie-olsztyn-jaroty-60-2m2-3-pokoje-ID4oc39,"60,2 m²",spółdzielcze wł. prawo do lokalu,3,do zamieszkania,3/4,balkon,514 zł,Zapytaj,Zapytaj,miejskie,wtórny,prywatny,brak informacji,1981,blok,plastikowe,nie,"telewizja kablowa, internet, telefon",domofon / wideofon,"zmywarka, lodówka, meble, piekarnik, kuchenka, pralka","piwnica, oddzielna kuchnia, pom. użytkowe",żelbet,2024-01-16,"Jana Boenigka, Jaroty, Olsztyn, warmińsko-mazurskie",20.5016114,53.7416876
5 pokoi 87 m² ul. Iwaszkiewicza 30,"Mieszkanie na sprzedaż: ul. Jarosława Iwaszkiewicza, Podgrodzie, Olsztyn, warmińsko-mazurskie",590000.0,6782,5 pokoi,87.0,87 m²,/pl/oferta/5-pokoi-87-m-ul-iwaszkiewicza-30-ID4nesJ,87 m²,pełna własność,5,do remontu,1/4,balkon,640 zł,Zapytaj,Zapytaj,miejskie,wtórny,prywatny,brak informacji,1990,blok,drewniane,nie,brak informacji,"drzwi / okna antywłamaniowe, domofon / wideofon",brak informacji,"piwnica, oddzielna kuchnia",wielka płyta,2024-01-16,"Jarosława Iwaszkiewicza, Podgrodzie, Olsztyn, warmińsko-mazurskie",20.4722415,53.7631368
"Mieszkanie 72,5m Iwaszkiewicza","Mieszkanie na sprzedaż: ul. Jarosława Iwaszkiewicza, Podgrodzie, Olsztyn, warmińsko-mazurskie",550000.0,7586,4 pokoje,72.5,"72,5 m²",/pl/oferta/mieszkanie-72-5m-iwaszkiewicza-ID4orOP,"72,5 m²",pełna własność,4,do zamieszkania,4/4,balkon,500 zł,Zapytaj,Zapytaj,miejskie,wtórny,prywatny,brak informacji,1990,blok,plastikowe,nie,brak informacji,domofon / wideofon,"zmywarka, lodówka, piekarnik, kuchenka","piwnica, oddzielna kuchnia",wielka płyta,2024-01-16,"Jarosława Iwaszkiewicza, Podgrodzie, Olsztyn, warmińsko-mazurskie",20.4722415,53.7631368
"Mieszkanie 74m2, Olsztyn, ul. Bartąska","Mieszkanie na sprzedaż: ul. Bartąska, Osiedle Generałów, Olsztyn, warmińsko-mazurskie",785000.0,10608,4 pokoje,74.0,Biuro nieruchomości,/pl/oferta/mieszkanie-74m2-olsztyn-ul-bartaska-ID4oFjq,74 m²,pełna własność,4,do zamieszkania,2/2,Zapytaj,500 zł,garaż/miejsce parkingowe,Zapytaj,miejskie,wtórny,biuro nieruchomości ,2024-02-15,2008,blok,plastikowe,nie,brak informacji,domofon / wideofon,"meble, lodówka, piekarnik, zmywarka, kuchenka",dwupoziomowe,pustak,2024-01-16,"Bartąska, Osiedle Generałów, Olsztyn, warmińsko-mazurskie",20.4837601,53.7388922
"Mieszkanie 36m2, Olsztyn Boenigka","Mieszkanie na sprzedaż: ul. Jana Boenigka, Jaroty, Olsztyn, warmińsko-mazurskie",365000.0,10139,2 pokoje,36.0,Biuro nieruchomości,/pl/oferta/mieszkanie-36m2-olsztyn-boenigka-ID4oFjk,36 m²,pełna własność,2,do zamieszkania,2/4,balkon,530 zł,garaż/miejsce parkingowe,Zapytaj,miejskie,wtórny,biuro nieruchomości ,2024-01-12,1984,blok,plastikowe,nie,brak informacji,domofon / wideofon,"lodówka, piekarnik, zmywarka, kuchenka",brak informacji,pustak,2024-01-16,"Jana Boenigka, Jaroty, Olsztyn, warmińsko-mazurskie",20.5016114,53.7416876
"Mieszkanie 47,2 m2 + loggia + piwnica ul. Dworcowa","Mieszkanie na sprzedaż: Pojezierze, Olsztyn, warmińsko-mazurskie",420000.0,8898,3 pokoje,47.2,"47,2 m²",/pl/oferta/mieszkanie-47-2-m2-loggia-piwnica-ul-dworcowa-ID4oF7U,"47,2 m²",spółdzielcze wł. prawo do lokalu,3,do wykończenia,4/4,Zapytaj,500 zł,Zapytaj,tak,miejskie,wtórny,prywatny,brak informacji,brak informacji,blok,plastikowe,tak,brak informacji,brak informacji,brak informacji,"piwnica, oddzielna kuchnia",brak informacji,2024-01-16,"Pojezierze, Olsztyn, warmińsko-mazurskie",20.5091749,53.7756169
Mieszkanie blisko Starego Miasta,"Mieszkanie na sprzedaż: Osiedle Grunwaldzkie, Olsztyn, warmińsko-mazurskie",340000.0,6719,3 pokoje,50.6,Biuro nieruchomości,/pl/oferta/mieszkanie-blisko-starego-miasta-ID4oF7C,"50,6 m²",pełna własność,3,do remontu,3/4,balkon,Zapytaj,Zapytaj,tak,miejskie,wtórny,biuro nieruchomości ,brak informacji,1960,blok,plastikowe,nie,brak informacji,domofon / wideofon,brak informacji,"piwnica, oddzielna kuchnia",cegła,2024-01-16,"Osiedle Grunwaldzkie, Olsztyn, warmińsko-mazurskie",20.4627226,53.7709262
"3 pokojowe, oddzielna kuchnia, duży balkon","Mieszkanie na sprzedaż: ul. Władysława Gębika, Pieczewo, Olsztyn, warmińsko-mazurskie",389000.0,6538,3 pokoje,59.5,Biuro nieruchomości,/pl/oferta/3-pokojowe-oddzielna-kuchnia-duzy-balkon-ID4ok5C,"59,5 m²",pełna własność,3,do remontu,4/4,Zapytaj,561 zł,Zapytaj,Zapytaj,miejskie,wtórny,biuro nieruchomości ,brak informacji,1989,blok,brak informacji,nie,brak informacji,brak informacji,brak informacji,oddzielna kuchnia,wielka płyta,2024-01-16,"Władysława Gębika, Pieczewo, Olsztyn, warmińsko-mazurskie",20.5121461,53.7403366
"2-pokojowe mieszkanie, gotowe do zamieszkania","Mieszkanie na sprzedaż: ul. Jana Żiżki, Osiedle Grunwaldzkie, Olsztyn, warmińsko-mazurskie",319000.0,8368,2 pokoje,38.12,Biuro nieruchomości,/pl/oferta/2-pokojowe-mieszkanie-gotowe-do-zamieszkania-ID4oEUd,"38,12 m²",pełna własność,2,do zamieszkania,3/4,Zapytaj,"625,28 zł",Zapytaj,Zapytaj,miejskie,wtórny,biuro nieruchomości ,brak informacji,1978,blok,brak informacji,nie,brak informacji,brak informacji,meble,"piwnica, oddzielna kuchnia, pom. użytkowe",brak informacji,2024-01-16,"Jana Żiżki, Osiedle Grunwaldzkie, Olsztyn, warmińsko-mazurskie",,
Kawalerka - Centrum - Olsztyn,"Mieszkanie na sprzedaż: ul. Marii Curie-Skłodowskiej, Śródmieście, Olsztyn, warmińsko-mazurskie",269000.0,9340,1 pokój,28.8,Biuro nieruchomości,/pl/oferta/kawalerka-centrum-olsztyn-ID4oEWp,"28,8 m²",Zapytaj,1,do remontu,3/4,Zapytaj,Zapytaj,Zapytaj,Zapytaj,miejskie,wtórny,biuro nieruchomości ,brak informacji,2004,kamienica,brak informacji,tak,brak informacji,brak informacji,brak informacji,brak informacji,brak informacji,2024-01-16,"Marii Curie-Skłodowskiej, Śródmieście, Olsztyn, warmińsko-mazurskie",20.4785571,53.7806591
"Mieszkanie59,5m² na Pieczewie, Świtycz-Widackiej 6","Mieszkanie na sprzedaż: ul. Balbiny Świtycz-Widackiej, Pieczewo, Olsztyn, warmińsko-mazurskie",469000.0,7882,3 pokoje,59.5,"59,5 m²",/pl/oferta/mieszkanie59-5m-na-pieczewie-switycz-widackiej-6-ID4osOk,"59,5 m²",pełna własność,3,do zamieszkania,2/4,balkon,800 zł,Zapytaj,Zapytaj,miejskie,wtórny,prywatny,brak informacji,brak informacji,blok,plastikowe,nie,"telewizja kablowa, internet",domofon / wideofon,"lodówka, meble, piekarnik, kuchenka",piwnica,wielka płyta,2024-01-16,"Balbiny Świtycz-Widackiej, Pieczewo, Olsztyn, warmińsko-mazurskie",20.5108662,53.7384254
Mieszkanie dwupoziomowe na sprzedaż,"Mieszkanie na sprzedaż: ul. Jarocka, Jaroty, Olsztyn, warmińsko-mazurskie",400000.0,7273,4 pokoje,55.0,55 m²,/pl/oferta/mieszkanie-dwupoziomowe-na-sprzedaz-ID4oETi,55 m²,pełna własność,4,do wykończenia,4/4,Zapytaj,132 zł,Zapytaj,Zapytaj,kotłownia,wtórny,prywatny,brak informacji,2000,blok,drewniane,nie,brak informacji,domofon / wideofon,"zmywarka, lodówka, piekarnik, kuchenka, pralka","piwnica, oddzielna kuchnia, dwupoziomowe",pustak,2024-01-16,"Jarocka, Jaroty, Olsztyn, warmińsko-mazurskie",20.4877306,53.7470571
"2-pokojowe mieszkanie, gotowe do zamieszkania","Mieszkanie na sprzedaż: ul. Jana Żiżki, Podgrodzie, Olsztyn, warmińsko-mazurskie",319000.0,8368,2 pokoje,38.12,Biuro nieruchomości,/pl/oferta/2-pokojowe-mieszkanie-gotowe-do-zamieszkania-ID4o8Nk,"38,12 m²",pełna własność,2,do zamieszkania,3/4,Zapytaj,"625,28 zł",Zapytaj,Zapytaj,miejskie,wtórny,biuro nieruchomości ,brak informacji,1978,blok,brak informacji,nie,brak informacji,brak informacji,meble,"piwnica, oddzielna kuchnia, pom. użytkowe",brak informacji,2024-01-16,"Jana Żiżki, Podgrodzie, Olsztyn, warmińsko-mazurskie",,
Przestronne klimatyczne mieszkanie w centrum,"Mieszkanie na sprzedaż: ul. Andrzeja Samulowskiego, Osiedle Kętrzyńskiego, Olsztyn, warmińsko-mazurskie",749000.0,6119,3 pokoje,122.4,Biuro nieruchomości,/pl/oferta/przestronne-klimatyczne-mieszkanie-w-centrum-ID4oER1,"122,4 m²",pełna własność,3,do zamieszkania,3/3,balkon,Zapytaj,garaż/miejsce parkingowe,Zapytaj,gazowe,wtórny,biuro nieruchomości ,brak informacji,1907,kamienica,drewniane,nie,"telewizja kablowa, internet, telefon",domofon / wideofon,meble,piwnica,cegła,2024-01-16,"Andrzeja Samulowskiego, Osiedle Kętrzyńskiego, Olsztyn, warmińsko-mazurskie",20.4838005,53.781347
Apartament Osiedle Belweder 108m2 + 2 Piwnice,"Mieszkanie na sprzedaż: ul. ks. Jerzego Popiełuszki, Osiedle Generałów, Olsztyn, warmińsko-mazurskie",999999.0,9259,4 pokoje,108.0,Biuro nieruchomości,/pl/oferta/apartament-osiedle-belweder-108m2-2-piwnice-ID4oEOL,108 m²,pełna własność,4,do zamieszkania,3/3,Zapytaj,700 zł,garaż/miejsce parkingowe,Zapytaj,miejskie,wtórny,biuro nieruchomości ,2024-01-12,2009,blok,plastikowe,nie,brak informacji,"monitoring / ochrona, domofon / wideofon",meble,brak informacji,cegła,2024-01-16,"ks. Jerzego Popiełuszki, Osiedle Generałów, Olsztyn, warmińsko-mazurskie",20.4788259,53.7391123
"Na sprzedaż wyjątkowy ""tercet egzotyczny""!","Mieszkanie na sprzedaż: ul. gen. Stefana Grota Roweckiego, Osiedle Generałów, Olsztyn, warmińsko-mazurskie",539000.0,7190,4 pokoje,74.97,Biuro nieruchomości,/pl/oferta/na-sprzedaz-wyjatkowy-tercet-egzotyczny-ID4lVGo,"74,97 m²",pełna własność,4,do zamieszkania,3/3,balkon,850 zł,garaż/miejsce parkingowe,Zapytaj,miejskie,wtórny,biuro nieruchomości ,brak informacji,2007,blok,brak informacji,nie,brak informacji,brak informacji,meble,"piwnica, pom. użytkowe",brak informacji,2024-01-16,"gen. Stefana Grota Roweckiego, Osiedle Generałów, Olsztyn, warmińsko-mazurskie",20.4760212,53.7401433
Gotowe do zamieszkania 72m2 na oś. Jaroty,"Mieszkanie na sprzedaż: ul. Jana Boenigka, Jaroty, Olsztyn, warmińsko-mazurskie",469000.0,6469,3 pokoje,72.5,Biuro nieruchomości,/pl/oferta/gotowe-do-zamieszkania-72m2-na-os-jaroty-ID4mOoL,"72,5 m²",pełna własność,3,do zamieszkania,4/4,balkon,Zapytaj,Zapytaj,Zapytaj,miejskie,wtórny,biuro nieruchomości ,brak informacji,1983,blok,brak informacji,nie,brak informacji,brak informacji,brak informacji,brak informacji,wielka płyta,2024-01-16,"Jana Boenigka, Jaroty, Olsztyn, warmińsko-mazurskie",20.5016114,53.7416876
