free_text,address,price,price_meter,rooms,area,more,add_link,scraping_date
!!! Ponownie dostępne!!! Mieszkanie dwupoziomowe,"Mieszkanie na sprzedaż: Jaroty, Stawiguda, olsztyński, warmińsko-mazurskie",779 000 zł,8954 zł/m²,4 pokoje,87 m²,87 m²,/pl/oferta/ponownie-dostepne-mieszkanie-dwupoziomowe-ID4nr56,01/16/24
Taras 23m2 / 3 przestronne pokoje / Kołobrzeska,"Mieszkanie na sprzedaż: ul. Kołobrzeska 36B, Pojezierze, Olsztyn, warmińsko-mazurskie","629 657,20 zł",7690 zł/m²,3 pokoje,"81,88 m²",Inwestycja deweloperska,/pl/oferta/taras-23m2-3-przestronne-pokoje-kolobrzeska-ID4915M,01/16/24
Gotowe do zamieszkania - blisko jezioro - Leśna 10,"Mieszkanie na sprzedaż: Osiedle Nad Jeziorem Długim, Olsztyn, warmińsko-mazurskie",699 000 zł,12 052 zł/m²,3 pokoje,58 m²,58 m²,/pl/oferta/gotowe-do-zamieszkania-blisko-jezioro-lesna-10-ID4ofbm,01/16/24
Kołobrzeska 36B Olsztyn / 4 pokoje / 82 m2,"Mieszkanie na sprzedaż: ul. Kołobrzeska 36B, Pojezierze, Olsztyn, warmińsko-mazurskie",592 456 zł,7190 zł/m²,4 pokoje,"82,4 m²",Inwestycja deweloperska,/pl/oferta/kolobrzeska-36b-olsztyn-4-pokoje-82-m2-ID490ZS,01/16/24
Os. Leśna | 2 - pokojowe mieszkanie A.III/37,"Mieszkanie na sprzedaż: ul. Leśna, Osiedle Nad Jeziorem Długim, Olsztyn, warmińsko-mazurskie",,,2 pokoje,"45,16 m²",Inwestycja deweloperska,/pl/oferta/os-lesna-2-pokojowe-mieszkanie-a-iii-37-ID4bpBq,01/16/24
Prestiżowy apartament nad Jeziorem,"Mieszkanie na sprzedaż: ul. Leśna, Osiedle Nad Jeziorem Długim, Olsztyn, warmińsko-mazurskie",1 337 424 zł,14 900 zł/m²,3 pokoje,"89,76 m²",Biuro nieruchomości,/pl/oferta/prestizowy-apartament-nad-jeziorem-ID4nPIc,01/16/24
"3-pokojowe mieszkanie z balkonem, Jaroty","Mieszkanie na sprzedaż: ul. Jarocka, Jaroty, Olsztyn, warmińsko-mazurskie",469 000 zł,8316 zł/m²,3 pokoje,"56,4 m²",Biuro nieruchomości,/pl/oferta/3-pokojowe-mieszkanie-z-balkonem-jaroty-ID4okpu,01/16/24
Mieszkanie bezczynszowe z własnym ogródkiem,"Mieszkanie na sprzedaż: Gutkowo, Olsztyn, warmińsko-mazurskie",650 000 zł,7306 zł/m²,4 pokoje,"88,97 m²",Inwestycja deweloperska,/pl/oferta/mieszkanie-bezczynszowe-z-wlasnym-ogrodkiem-ID4giRw,01/16/24
Apartamenty Wyzwolenia | apartament nr 60,"Mieszkanie na sprzedaż: ul. Wyzwolenia, Śródmieście, Olsztyn, warmińsko-mazurskie",517 824 zł,12 400 zł/m²,2 pokoje,"41,76 m²",Inwestycja deweloperska,/pl/oferta/apartamenty-wyzwolenia-apartament-nr-60-ID4nyy4,01/16/24
3 pokoje w centrum miasta z pięknym widokiem!,"Mieszkanie na sprzedaż: ul. Walentego Barczewskiego, Podgrodzie, Olsztyn, warmińsko-mazurskie",649 000 zł,11 426 zł/m²,3 pokoje,"56,8 m²",Biuro nieruchomości,/pl/oferta/3-pokoje-w-centrum-miasta-z-pieknym-widokiem-ID4omXQ,01/16/24
Warszawska99 | mieszkanie 2-pok. | 10,"Mieszkanie na sprzedaż: al. Aleja Warszawska, Kortowo, Olsztyn, warmińsko-mazurskie",,,2 pokoje,"46,23 m²",Inwestycja deweloperska,/pl/oferta/warszawska99-mieszkanie-2-pok-10-ID4nu6s,01/16/24
Mieszkanie na parterze - Osiedle Belweder,"Mieszkanie na sprzedaż: Osiedle Generałów, Olsztyn, warmińsko-mazurskie",480 000 zł,8000 zł/m²,2 pokoje,60 m²,60 m²,/pl/oferta/mieszkanie-na-parterze-osiedle-belweder-ID4mVx4,01/16/24
"Mieszkanie po remoncie, I p., 35 m2","Mieszkanie na sprzedaż: ul. Jana Kasprowicza, Osiedle Wojska Polskiego, Olsztyn, warmińsko-mazurskie",300 000 zł,8658 zł/m²,2 pokoje,"34,65 m²",Biuro nieruchomości,/pl/oferta/mieszkanie-po-remoncie-i-p-35-m2-ID4orAk,01/16/24
"Olsztyn (Jaroty) - 48,10 m2 ul. Herberta","Mieszkanie na sprzedaż: ul. Zbigniewa Herberta 12, Jaroty, Olsztyn, warmińsko-mazurskie",350 000 zł,7277 zł/m²,2 pokoje,"48,1 m²","48,1 m²",/pl/oferta/olsztyn-jaroty-48-10-m2-ul-herberta-ID4jfcA,01/16/24
"Mieszkanie, 3 pokoje, Olsztyn, osiedle Podleśna","Mieszkanie na sprzedaż: ul. Chełmińska, Podleśna, Olsztyn, warmińsko-mazurskie",420 000 zł,6462 zł/m²,3 pokoje,65 m²,65 m²,/pl/oferta/mieszkanie-3-pokoje-olsztyn-osiedle-podlesna-ID4od8M,01/16/24
Mieszkanie Kętrzyńskiego,"Mieszkanie na sprzedaż: ul. Wojciecha Kętrzyńskiego, Osiedle Kętrzyńskiego, Olsztyn, warmińsko-mazurskie",479 000 zł,6843 zł/m²,4 pokoje,70 m²,Biuro nieruchomości,/pl/oferta/mieszkanie-ketrzynskiego-ID4m1Es,01/16/24
Mieszkanie na sprzedaż 56m2-Olsztyn centrum,"Mieszkanie na sprzedaż: Zatorze, Olsztyn, warmińsko-mazurskie",460 000 zł,8214 zł/m²,3 pokoje,56 m²,Biuro nieruchomości,/pl/oferta/mieszkanie-na-sprzedaz-56m2-olsztyn-centrum-ID4okzf,01/16/24
Mieszkanie na 1 piętrze Olsztyn,"Mieszkanie na sprzedaż: ul. Kardynała Stefana Wyszyńskiego, Kormoran, Olsztyn, warmińsko-mazurskie",380 000 zł,10 000 zł/m²,2 pokoje,38 m²,Biuro nieruchomości,/pl/oferta/mieszkanie-na-1-pietrze-olsztyn-ID4orr3,01/16/24
Atrakcyjne mieszkanie 2-pokojowe do sprzedaży,"Mieszkanie na sprzedaż: al. Aleja Warszawska, Podgrodzie, Olsztyn, warmińsko-mazurskie",385 000 zł,9255 zł/m²,2 pokoje,"41,6 m²",Biuro nieruchomości,/pl/oferta/atrakcyjne-mieszkanie-2-pokojowe-do-sprzedazy-ID4orr2,01/16/24
Apartament Bezczynszowy 90m od jeziora Ukiel,"Mieszkanie na sprzedaż: ul. Pawia, Gutkowo, Olsztyn, warmińsko-mazurskie",590 000 zł,5268 zł/m²,5 pokoi,112 m²,Biuro nieruchomości,/pl/oferta/apartament-bezczynszowy-90m-od-jeziora-ukiel-ID4nUIL,01/16/24
"Mieszkanie 51m2, Olsztyn, ul. Armii Krajowej","Mieszkanie na sprzedaż: ul. Armii Krajowej, Osiedle Grunwaldzkie, Olsztyn, warmińsko-mazurskie",595 000 zł,11 667 zł/m²,2 pokoje,51 m²,Biuro nieruchomości,/pl/oferta/mieszkanie-51m2-olsztyn-ul-armii-krajowej-ID4nW5O,01/16/24
3 pokojowe mieszkanie po generalnym remoncie!,"Mieszkanie na sprzedaż: ul. Ignacego Paderewskiego, Podleśna, Olsztyn, warmińsko-mazurskie",415 000 zł,8585 zł/m²,3 pokoje,"48,34 m²","48,34 m²",/pl/oferta/3-pokojowe-mieszkanie-po-generalnym-remoncie-ID4nJgl,01/16/24
"Mieszkanie Olsztyn-Jaroty 60,2m2, 3 pokoje","Mieszkanie na sprzedaż: ul. Jana Boenigka, Jaroty, Olsztyn, warmińsko-mazurskie",490 000 zł,8140 zł/m²,3 pokoje,"60,2 m²","60,2 m²",/pl/oferta/mieszkanie-olsztyn-jaroty-60-2m2-3-pokoje-ID4oc39,01/16/24
"Osiedle Aurora, M69, widok na Park","Mieszkanie na sprzedaż: ul. Franciszka Barcza 50, Nagórki, Olsztyn, warmińsko-mazurskie",837 018 zł,9100 zł/m²,5 pokoi,"91,98 m²",Inwestycja deweloperska,/pl/oferta/osiedle-aurora-m69-widok-na-park-ID4evWB,01/16/24
Mieszkanie - Olsztyn,"Mieszkanie na sprzedaż: ul. ks. Wacława Osińskiego, Podgrodzie, Olsztyn, warmińsko-mazurskie",367 290 zł,7573 zł/m²,2 pokoje,"48,5 m²",Biuro nieruchomości,/pl/oferta/mieszkanie-olsztyn-ID4or18,01/16/24
2 pokojowe mieszkanie na Jarotach!,"Mieszkanie na sprzedaż: Jaroty, Olsztyn, warmińsko-mazurskie",419 000 zł,7212 zł/m²,2 pokoje,"58,1 m²",Biuro nieruchomości,/pl/oferta/2-pokojowe-mieszkanie-na-jarotach-ID4or02,01/16/24
"Mieszkanie Pana Tadeusza, parter","Mieszkanie na sprzedaż: ul. Pana Tadeusza, Pojezierze, Olsztyn, warmińsko-mazurskie",369 000 zł,10 853 zł/m²,2 pokoje,34 m²,34 m²,/pl/oferta/mieszkanie-pana-tadeusza-parter-ID4obMn,01/16/24
Mieszkanie na zamkniętym osiedlu Barcza | 3 pokoje,"Mieszkanie na sprzedaż: ul. Franciszka Barcza, Nagórki, Olsztyn, warmińsko-mazurskie",554 000 zł,8816 zł/m²,3 pokoje,"62,84 m²",Biuro nieruchomości,/pl/oferta/mieszkanie-na-zamknietym-osiedlu-barcza-3-pokoje-ID4oqQz,01/16/24
Mieszkanie inwestycyjne - Podgrodzie Olsztyn,"Mieszkanie na sprzedaż: Podgrodzie, Olsztyn, warmińsko-mazurskie",266 000 zł,6650 zł/m²,2 pokoje,40 m²,Biuro nieruchomości,/pl/oferta/mieszkanie-inwestycyjne-podgrodzie-olsztyn-ID4oqP7,01/16/24
"Iwaszkiewicza - 3 pokoje, 1 piętro","Mieszkanie na sprzedaż: ul. Jarosława Iwaszkiewicza, Podgrodzie, Olsztyn, warmińsko-mazurskie",449 000 zł,7496 zł/m²,3 pokoje,"59,9 m²",Biuro nieruchomości,/pl/oferta/iwaszkiewicza-3-pokoje-1-pietro-ID4oqFp,01/16/24
sprzedam trzypokojowe mieszkanie BEZ POŚREDNIKÓW,"Mieszkanie na sprzedaż: ul. Jarocka, Jaroty, Olsztyn, warmińsko-mazurskie",403 000 zł,8648 zł/m²,3 pokoje,"46,6 m²","46,6 m²",/pl/oferta/sprzedam-trzypokojowe-mieszkanie-bez-posrednikow-ID4nTZ1,01/16/24
"Mieszkanie 63,8 m2 idealne dla rodziny","Mieszkanie na sprzedaż: ul. Majora Henryka Sucharskiego, Osiedle Generałów, Olsztyn, warmińsko-mazurskie",550 000 zł,8621 zł/m²,3 pokoje,"63,8 m²",Biuro nieruchomości,/pl/oferta/mieszkanie-63-8-m2-idealne-dla-rodziny-ID4nPIB,01/16/24
"Mieszkanie W Kamienicy Na Parterze, Centrum","Mieszkanie na sprzedaż: ul. Bolesława Prusa, Osiedle Wojska Polskiego, Olsztyn, warmińsko-mazurskie",579 000 zł,4772 zł/m²,4 pokoje,"121,34 m²",Biuro nieruchomości,/pl/oferta/mieszkanie-w-kamienicy-na-parterze-centrum-ID4lyln,01/16/24
Mieszkanie w ścisłym Centrum Olsztyna,"Mieszkanie na sprzedaż: ul. Grunwaldzka, Śródmieście, Olsztyn, warmińsko-mazurskie",329 000 zł,8797 zł/m²,1 pokój,"37,4 m²",Biuro nieruchomości,/pl/oferta/mieszkanie-w-scislym-centrum-olsztyna-ID4oqrK,01/16/24
"Mieszkanie 2 pokojowe, Iwaszkiewicza 10, Olsztyn","Mieszkanie na sprzedaż: ul. Jarosława Iwaszkiewicza, Podgrodzie, Olsztyn, warmińsko-mazurskie",419 000 zł,8928 zł/m²,2 pokoje,"46,93 m²",Biuro nieruchomości,/pl/oferta/mieszkanie-2-pokojowe-iwaszkiewicza-10-olsztyn-ID4obBF,01/16/24
"Mieszkanie, 65 m², Olsztyn","Mieszkanie na sprzedaż: ul. Jarocka, Jaroty, Olsztyn, warmińsko-mazurskie",403 000 zł,6200 zł/m²,3 pokoje,65 m²,Biuro nieruchomości,/pl/oferta/mieszkanie-65-m-olsztyn-ID4nHK0,01/16/24
Popiełuszki 26 - kompaktowe 2 pokojowe,"Mieszkanie na sprzedaż: ul. ks. Jerzego Popiełuszki, Osiedle Generałów, Olsztyn, warmińsko-mazurskie",355 000 zł,12 331 zł/m²,2 pokoje,"28,79 m²",Biuro nieruchomości,/pl/oferta/popieluszki-26-kompaktowe-2-pokojowe-ID4oq3z,01/16/24
Apartamenty Wyzwolenia | apartament nr 9,"Mieszkanie na sprzedaż: ul. Wyzwolenia, Śródmieście, Olsztyn, warmińsko-mazurskie",590 304 zł,10 400 zł/m²,3 pokoje,"56,76 m²",Inwestycja deweloperska,/pl/oferta/apartamenty-wyzwolenia-apartament-nr-9-ID4cgUe,01/16/24
Dwupokojowe mieszkanie blisko centrum miasta,"Mieszkanie na sprzedaż: ul. Dworcowa, Kormoran, Olsztyn, warmińsko-mazurskie",299 000 zł,8352 zł/m²,2 pokoje,"35,8 m²",Biuro nieruchomości,/pl/oferta/dwupokojowe-mieszkanie-blisko-centrum-miasta-ID4opYr,01/16/24
"Dwa pokoje, 39 m2, Popiełuszki,osiedle Generałów","Mieszkanie na sprzedaż: ul. ks. Jerzego Popiełuszki, Osiedle Generałów, Olsztyn, warmińsko-mazurskie",430 000 zł,10 916 zł/m²,2 pokoje,"39,39 m²",Biuro nieruchomości,/pl/oferta/dwa-pokoje-39-m2-popieluszki-osiedle-generalow-ID4opJo,01/16/24
"Mieszkanie, 35,80 m², Olsztyn","Mieszkanie na sprzedaż: Nagórki, Olsztyn, warmińsko-mazurskie",289 000 zł,8073 zł/m²,2 pokoje,"35,8 m²",Biuro nieruchomości,/pl/oferta/mieszkanie-35-80-m-olsztyn-ID4opIF,01/16/24
"Osiedle Aurora, M65, ogród zimowy z balkonem","Mieszkanie na sprzedaż: ul. Franciszka Barcza 50, Nagórki, Olsztyn, warmińsko-mazurskie",827 820 zł,9000 zł/m²,5 pokoi,"91,98 m²",Inwestycja deweloperska,/pl/oferta/osiedle-aurora-m65-ogrod-zimowy-z-balkonem-ID4evWl,01/16/24
Apartamenty Wyzwolenia | atrakcyjny apartament,"Mieszkanie na sprzedaż: ul. Wyzwolenia, Śródmieście, Olsztyn, warmińsko-mazurskie",911 508 zł,10 850 zł/m²,3 pokoje,"84,01 m²",Inwestycja deweloperska,/pl/oferta/apartamenty-wyzwolenia-atrakcyjny-apartament-ID4cfU4,01/16/24
Sucharskiego 4 - 2 pokoje z oddzielną kuchnią,"Mieszkanie na sprzedaż: ul. Majora Henryka Sucharskiego, Osiedle Generałów, Olsztyn, warmińsko-mazurskie",385 000 zł,8953 zł/m²,2 pokoje,43 m²,Biuro nieruchomości,/pl/oferta/sucharskiego-4-2-pokoje-z-oddzielna-kuchnia-ID4opfO,01/16/24
Złota 4 - dwa słoneczne pokoje + msc. parkingowe,"Mieszkanie na sprzedaż: ul. Złota, Osiedle Generałów, Olsztyn, warmińsko-mazurskie",359 000 zł,8118 zł/m²,2 pokoje,"44,22 m²",Biuro nieruchomości,/pl/oferta/zlota-4-dwa-sloneczne-pokoje-msc-parkingowe-ID4op4I,01/16/24
2 pokoje z oddzielną kuchnią - Jaroty,"Mieszkanie na sprzedaż: ul. Pieczewska, Jaroty, Olsztyn, warmińsko-mazurskie",339 000 zł,9549 zł/m²,2 pokoje,"35,5 m²",Biuro nieruchomości,/pl/oferta/2-pokoje-z-oddzielna-kuchnia-jaroty-ID4op4H,01/16/24
"Versal - Armii Krajowej 3, przy plaży i Uwm","Mieszkanie na sprzedaż: Armii Krajowej al., Osiedle Grunwaldzkie, Olsztyn, warmińsko-mazurskie",595 000 zł,11 667 zł/m²,2 pokoje,51 m²,Biuro nieruchomości,/pl/oferta/versal-armii-krajowej-3-przy-plazy-i-uwm-ID4op4D,01/16/24
Apartamenty Wyzwolenia | apartament nr 62,"Mieszkanie na sprzedaż: ul. Wyzwolenia, Śródmieście, Olsztyn, warmińsko-mazurskie",498 976 zł,12 400 zł/m²,2 pokoje,"40,24 m²",Inwestycja deweloperska,/pl/oferta/apartamenty-wyzwolenia-apartament-nr-62-ID4nyy3,01/16/24
Mieszkanie z potencjałem: Twoje okno na świat,"Mieszkanie na sprzedaż: ul. Mieczysława Orłowicza, Nagórki, Olsztyn, warmińsko-mazurskie",435 000 zł,5975 zł/m²,4 pokoje,"72,8 m²",Biuro nieruchomości,/pl/oferta/mieszkanie-z-potencjalem-twoje-okno-na-swiat-ID4o2ME,01/16/24
Atrakcyjne mieszkanie Wojska Polskiego,"Mieszkanie na sprzedaż: al. Aleja Wojska Polskiego, Osiedle Wojska Polskiego, Olsztyn, warmińsko-mazurskie",425 000 zł,6498 zł/m²,4 pokoje,"65,4 m²",Biuro nieruchomości,/pl/oferta/atrakcyjne-mieszkanie-wojska-polskiego-ID4nWqv,01/16/24
"Mieszkanie, 48,10 m², Olsztyn","Mieszkanie na sprzedaż: Pojezierze, Olsztyn, warmińsko-mazurskie",419 000 zł,8711 zł/m²,3 pokoje,"48,1 m²",Biuro nieruchomości,/pl/oferta/mieszkanie-48-10-m-olsztyn-ID4oozt,01/16/24
Apartamenty Wyzwolenia | apartament nr 52,"Mieszkanie na sprzedaż: ul. Wyzwolenia, Śródmieście, Olsztyn, warmińsko-mazurskie",700 724 zł,12 400 zł/m²,3 pokoje,"56,51 m²",Inwestycja deweloperska,/pl/oferta/apartamenty-wyzwolenia-apartament-nr-52-ID4nyxX,01/16/24
"ul.Boenigka 32, 35,9m2,2pok.IIp./IVp., balkon - Do","Mieszkanie na sprzedaż: ul. Jana Boenigka, Jaroty, Olsztyn, warmińsko-mazurskie",365 000 zł,10 139 zł/m²,2 pokoje,36 m²,Biuro nieruchomości,/pl/oferta/ul-boenigka-32-35-9m2-2pok-iip-ivp-balkon-do-ID4n3uL,01/16/24
mieszkanie 3 pokoje Olsztyn- Pieczewo ul. Gębika,"Mieszkanie na sprzedaż: ul. Władysława Gębika, Pieczewo, Olsztyn, warmińsko-mazurskie",465 000 zł,8675 zł/m²,3 pokoje,"53,6 m²",Biuro nieruchomości,/pl/oferta/mieszkanie-3-pokoje-olsztyn-pieczewo-ul-gebika-ID4onBx,01/16/24
Nowe 3 pok.IBezpośrednio I Centrum,"Mieszkanie na sprzedaż: ul. Wincentego Pstrowskiego, Osiedle Mazurskie, Olsztyn, warmińsko-mazurskie",519 000 zł,9258 zł/m²,3 pokoje,"56,06 m²","56,06 m²",/pl/oferta/nowe-3-pok-ibezposrednio-i-centrum-ID4nBNU,01/16/24
Sprzedam mieszkanie dwupokojowe,"Mieszkanie na sprzedaż: Osiedle Grunwaldzkie, Olsztyn, warmińsko-mazurskie",410 000 zł,8016 zł/m²,2 pokoje,"51,15 m²","51,15 m²",/pl/oferta/sprzedam-mieszkanie-dwupokojowe-ID4nQGr,01/16/24
sprzedam mieszkanie,"Mieszkanie na sprzedaż: Śródmieście, Olsztyn, warmińsko-mazurskie",342 000 zł,9118 zł/m²,2 pokoje,"37,51 m²",Biuro nieruchomości,/pl/oferta/sprzedam-mieszkanie-ID4ecR5,01/16/24
DOM - Apartamenty Na Wzgórzu - B2.B. - WADĄG,"Mieszkanie na sprzedaż: Śródmieście, Olsztyn, warmińsko-mazurskie",585 735 zł,5100 zł/m²,5 pokoi,"114,85 m²","114,85 m²",/pl/oferta/dom-apartamenty-na-wzgorzu-b2-b-wadag-ID4nQjn,01/16/24
DOM - Apartamenty Na Wzgórzu - B1.B. - WADĄG,"Mieszkanie na sprzedaż: Śródmieście, Olsztyn, warmińsko-mazurskie",648 465 zł,5100 zł/m²,5 pokoi,"127,15 m²","127,15 m²",/pl/oferta/dom-apartamenty-na-wzgorzu-b1-b-wadag-ID4nQiO,01/16/24
Bianco | mieszkanie 4 pok. M24,"Mieszkanie na sprzedaż: ul. Kardynała Stefana Wyszyńskiego, Kormoran, Olsztyn, warmińsko-mazurskie",,,4 pokoje,"89,82 m²",Inwestycja deweloperska,/pl/oferta/bianco-mieszkanie-4-pok-m24-ID4jWDW,01/16/24
4 pokoje w nowym bloku - Poprzeczna,"Mieszkanie na sprzedaż: ul. Poprzeczna, Podleśna, Olsztyn, warmińsko-mazurskie",759 000 zł,10 843 zł/m²,4 pokoje,70 m²,Biuro nieruchomości,/pl/oferta/4-pokoje-w-nowym-bloku-poprzeczna-ID4omXP,01/16/24
"Osiedle Aurora, M32, 3 pokoje, pralnia","Mieszkanie na sprzedaż: ul. Franciszka Barcza 50, Nagórki, Olsztyn, warmińsko-mazurskie",900 240 zł,12 000 zł/m²,3 pokoje,"75,02 m²",Inwestycja deweloperska,/pl/oferta/osiedle-aurora-m32-3-pokoje-pralnia-ID4evU1,01/16/24
Mieszkanie z balkonem i strychem - ul. Kiemliczów,"Mieszkanie na sprzedaż: Gutkowo, Olsztyn, warmińsko-mazurskie",560 000 zł,7000 zł/m²,3 pokoje,80 m²,Inwestycja deweloperska,/pl/oferta/mieszkanie-z-balkonem-i-strychem-ul-kiemliczow-ID4o6w2,01/16/24
Bianco | mieszkanie 3 pok. M14,"Mieszkanie na sprzedaż: ul. Kardynała Stefana Wyszyńskiego, Kormoran, Olsztyn, warmińsko-mazurskie",552 000 zł,8586 zł/m²,3 pokoje,"64,29 m²",Inwestycja deweloperska,/pl/oferta/bianco-mieszkanie-3-pok-m14-ID4jWDT,01/16/24
"Apartament+antresola+taras -109,79m2- Miła Resort","Mieszkanie na sprzedaż: ul. Sielska, Dajtki, Olsztyn, warmińsko-mazurskie",1 317 370 zł,11 999 zł/m²,3 pokoje,"109,79 m²",Biuro nieruchomości,/pl/oferta/apartament-antresola-taras-109-79m2-mila-resort-ID4omOF,01/16/24
"Apartament z antresolą - 75,77 m2 - Miła Resort","Mieszkanie na sprzedaż: ul. Sielska, Dajtki, Olsztyn, warmińsko-mazurskie",681 854 zł,8999 zł/m²,2 pokoje,"75,77 m²",Biuro nieruchomości,/pl/oferta/apartament-z-antresola-75-77-m2-mila-resort-ID4omOH,01/16/24
"Apartament z antresolą - 89,92 m2 - Miła Resort","Mieszkanie na sprzedaż: ul. Sielska, Dajtki, Olsztyn, warmińsko-mazurskie",1 078 950 zł,11 999 zł/m²,2 pokoje,"89,92 m²",Biuro nieruchomości,/pl/oferta/apartament-z-antresola-89-92-m2-mila-resort-ID4omM6,01/16/24
"Apartament - 38,17 m2 - Miła Resort","Mieszkanie na sprzedaż: ul. Sielska, Dajtki, Olsztyn, warmińsko-mazurskie",381 661 zł,9999 zł/m²,1 pokój,"38,17 m²",Biuro nieruchomości,/pl/oferta/apartament-38-17-m2-mila-resort-ID4omM5,01/16/24
"Apartament - 3 pokoje - 64,1 m2 - Miła Resort","Mieszkanie na sprzedaż: ul. Sielska, Dajtki, Olsztyn, warmińsko-mazurskie",705 035 zł,10 999 zł/m²,3 pokoje,"64,1 m²",Biuro nieruchomości,/pl/oferta/apartament-3-pokoje-64-1-m2-mila-resort-ID4omLZ,01/16/24
"Apartament - 44,95 m2 - Miła Resort","Mieszkanie na sprzedaż: ul. Sielska, Dajtki, Olsztyn, warmińsko-mazurskie",449 455 zł,9999 zł/m²,1 pokój,"44,95 m²",Biuro nieruchomości,/pl/oferta/apartament-44-95-m2-mila-resort-ID4omM2,01/16/24
"Apartament - 2 pokoje - 48,07 m2 - Miła Resort","Mieszkanie na sprzedaż: ul. Sielska, Dajtki, Olsztyn, warmińsko-mazurskie",528 721 zł,10 999 zł/m²,3 pokoje,"48,07 m²",Biuro nieruchomości,/pl/oferta/apartament-2-pokoje-48-07-m2-mila-resort-ID4omLU,01/16/24
"Apartament - 31,7 m2 - Miła Resort","Mieszkanie na sprzedaż: ul. Sielska, Dajtki, Olsztyn, warmińsko-mazurskie",348 668 zł,10 999 zł/m²,1 pokój,"31,7 m²",Biuro nieruchomości,/pl/oferta/apartament-31-7-m2-mila-resort-ID4omLS,01/16/24
"Apartament - 37,96 m2 - Miła Resort","Mieszkanie na sprzedaż: ul. Sielska, Dajtki, Olsztyn, warmińsko-mazurskie",379 562 zł,9999 zł/m²,1 pokój,"37,96 m²",Biuro nieruchomości,/pl/oferta/apartament-37-96-m2-mila-resort-ID4omLR,01/16/24
"Mieszkanie, 2 pokoje, pojezierze","Mieszkanie na sprzedaż: Śródmieście, Olsztyn, warmińsko-mazurskie",269 000 zł,8328 zł/m²,2 pokoje,"32,3 m²",Biuro nieruchomości,/pl/oferta/mieszkanie-2-pokoje-pojezierze-ID4no8J,01/16/24
Mieszkanie z balkonem i strychem - ul. Kiemliczów,"Mieszkanie na sprzedaż: Gutkowo, Olsztyn, warmińsko-mazurskie",560 000 zł,7000 zł/m²,3 pokoje,80 m²,Inwestycja deweloperska,/pl/oferta/mieszkanie-z-balkonem-i-strychem-ul-kiemliczow-ID4o6w0,01/16/24
Bianco | mieszkanie 4 pok. M12,"Mieszkanie na sprzedaż: ul. Kardynała Stefana Wyszyńskiego, Kormoran, Olsztyn, warmińsko-mazurskie",708 000 zł,7882 zł/m²,4 pokoje,"89,82 m²",Inwestycja deweloperska,/pl/oferta/bianco-mieszkanie-4-pok-m12-ID4jWDR,01/16/24
Apartamenty Wyzwolenia | apartament nr 75,"Mieszkanie na sprzedaż: ul. Wyzwolenia, Śródmieście, Olsztyn, warmińsko-mazurskie",388 608 zł,12 800 zł/m²,1 pokój,"30,36 m²",Inwestycja deweloperska,/pl/oferta/apartamenty-wyzwolenia-apartament-nr-75-ID4chIq,01/16/24
"Apartament - 39,11 m2 - Miła Resort","Mieszkanie na sprzedaż: ul. Sielska, Dajtki, Olsztyn, warmińsko-mazurskie",391 061 zł,9999 zł/m²,1 pokój,"39,11 m²",Biuro nieruchomości,/pl/oferta/apartament-39-11-m2-mila-resort-ID4omoU,01/16/24
"Apartament 2 pokoje 50,11m2-Miła Resort","Mieszkanie na sprzedaż: ul. Sielska, Dajtki, Olsztyn, warmińsko-mazurskie",450 940 zł,8999 zł/m²,2 pokoje,"50,11 m²",Biuro nieruchomości,/pl/oferta/apartament-2-pokoje-50-11m2-mila-resort-ID4omoT,01/16/24
"Apartament - 42,04 m2 - Miła Resort","Mieszkanie na sprzedaż: ul. Sielska, Dajtki, Olsztyn, warmińsko-mazurskie",378 318 zł,8999 zł/m²,2 pokoje,"42,04 m²",Biuro nieruchomości,/pl/oferta/apartament-42-04-m2-mila-resort-ID4omoS,01/16/24
"Apartament - dwa pokoje - 41,75 m2 - Miła Resort","Mieszkanie na sprzedaż: ul. Sielska, Dajtki, Olsztyn, warmińsko-mazurskie",375 708 zł,8999 zł/m²,2 pokoje,"41,75 m²",Biuro nieruchomości,/pl/oferta/apartament-dwa-pokoje-41-75-m2-mila-resort-ID4omoM,01/16/24
"Apartament z antresolą - 105,17 m2 - Miła Resort","Mieszkanie na sprzedaż: ul. Sielska, Dajtki, Olsztyn, warmińsko-mazurskie","946 424,83 zł",8999 zł/m²,2 pokoje,"105,17 m²",Biuro nieruchomości,/pl/oferta/apartament-z-antresola-105-17-m2-mila-resort-ID4omoN,01/16/24
"Apartament 2 pokoje 67,94m2 - Miła Resort","Mieszkanie na sprzedaż: ul. Sielska, Dajtki, Olsztyn, warmińsko-mazurskie",679 332 zł,9999 zł/m²,2 pokoje,"67,94 m²",Biuro nieruchomości,/pl/oferta/apartament-2-pokoje-67-94m2-mila-resort-ID4omoQ,01/16/24
"Apartament - 37,87 m2 - Miła Resort","Mieszkanie na sprzedaż: ul. Sielska, Dajtki, Olsztyn, warmińsko-mazurskie",378 662 zł,9999 zł/m²,1 pokój,"37,87 m²",Biuro nieruchomości,/pl/oferta/apartament-37-87-m2-mila-resort-ID4omoO,01/16/24
"Apartament - trzypokojowy - 64,46 m2 - Miła Resort","Mieszkanie na sprzedaż: ul. Sielska, Dajtki, Olsztyn, warmińsko-mazurskie",644 536 zł,9999 zł/m²,3 pokoje,"64,46 m²",Biuro nieruchomości,/pl/oferta/apartament-trzypokojowy-64-46-m2-mila-resort-ID4omoL,01/16/24
"Apartament - dwupokojowy - 48,13 m2 - Miła Resort","Mieszkanie na sprzedaż: ul. Sielska, Dajtki, Olsztyn, warmińsko-mazurskie",481 252 zł,9999 zł/m²,2 pokoje,"48,13 m²",Biuro nieruchomości,/pl/oferta/apartament-dwupokojowy-48-13-m2-mila-resort-ID4omoJ,01/16/24
"Apartament - dwa pokoje - 57,03 m2 - Miła Resort","Mieszkanie na sprzedaż: ul. Sielska, Dajtki, Olsztyn, warmińsko-mazurskie",513 213 zł,8999 zł/m²,2 pokoje,"57,03 m²",Biuro nieruchomości,/pl/oferta/apartament-dwa-pokoje-57-03-m2-mila-resort-ID4omoI,01/16/24
"2 pokoje, balkon, parking","Mieszkanie na sprzedaż: ul. Lawendowa, Redykajny, Olsztyn, warmińsko-mazurskie",350 000 zł,9534 zł/m²,2 pokoje,"36,71 m²",Biuro nieruchomości,/pl/oferta/2-pokoje-balkon-parking-ID4omin,01/16/24
Przestronne dwupokojowe mieszkanie na Zatorzu!,"Mieszkanie na sprzedaż: ul. Jagiellońska, Osiedle Wojska Polskiego, Olsztyn, warmińsko-mazurskie",360 000 zł,7895 zł/m²,2 pokoje,"45,6 m²",Biuro nieruchomości,/pl/oferta/przestronne-dwupokojowe-mieszkanie-na-zatorzu-ID4omhR,01/16/24
Nieruchomość inwestycyjna Stare Miasto Olsztyn,"Mieszkanie na sprzedaż: ul. Hugona Kołłątaja, Śródmieście, Olsztyn, warmińsko-mazurskie",970 000 zł,10 883 zł/m²,3 pokoje,"89,13 m²",Biuro nieruchomości,/pl/oferta/nieruchomosc-inwestycyjna-stare-miasto-olsztyn-ID4omhj,01/16/24
3-pokojowe mieszkanie na Krasickiego,"Mieszkanie na sprzedaż: ul. Ignacego Krasickiego, Pieczewo, Olsztyn, warmińsko-mazurskie",380 000 zł,6291 zł/m²,3 pokoje,"60,4 m²",Biuro nieruchomości,/pl/oferta/3-pokojowe-mieszkanie-na-krasickiego-ID4omhn,01/16/24
Duże M-3 przy ul. Kanta/Jaroty,"Mieszkanie na sprzedaż: ul. Immanuela Kanta, Jaroty, Olsztyn, warmińsko-mazurskie",595 000 zł,8106 zł/m²,3 pokoje,"73,4 m²",Biuro nieruchomości,/pl/oferta/duze-m-3-przy-ul-kanta-jaroty-ID4omfe,01/16/24
"Apartament nad jeziorem Ukiel, Olsztyn","Mieszkanie na sprzedaż: Likusy, Olsztyn, warmińsko-mazurskie",995 000 zł,19 579 zł/m²,3 pokoje,"50,82 m²",Biuro nieruchomości,/pl/oferta/apartament-nad-jeziorem-ukiel-olsztyn-ID4nvH1,01/16/24
Mieszkanie na sprzedaż blisko Starego Miasta,"Mieszkanie na sprzedaż: ul. Grunwaldzka, Śródmieście, Olsztyn, warmińsko-mazurskie",439 000 zł,8201 zł/m²,2 pokoje,"53,53 m²",Biuro nieruchomości,/pl/oferta/mieszkanie-na-sprzedaz-blisko-starego-miasta-ID4lQAA,01/16/24
Mieszkanie z ogródkiem Olsztyn ul. Kiemliczów,"Mieszkanie na sprzedaż: Gutkowo, Olsztyn, warmińsko-mazurskie",570 000 zł,7945 zł/m²,3 pokoje,"71,74 m²",Inwestycja deweloperska,/pl/oferta/mieszkanie-z-ogrodkiem-olsztyn-ul-kiemliczow-ID4o6tQ,01/16/24
Mieszkanie z balkonem i strychem - ul. Kiemliczów,"Mieszkanie na sprzedaż: Gutkowo, Olsztyn, warmińsko-mazurskie",560 000 zł,7000 zł/m²,3 pokoje,80 m²,Inwestycja deweloperska,/pl/oferta/mieszkanie-z-balkonem-i-strychem-ul-kiemliczow-ID4o6uY,01/16/24
Bianco | mieszkanie 4 pok. M18,"Mieszkanie na sprzedaż: ul. Kardynała Stefana Wyszyńskiego, Kormoran, Olsztyn, warmińsko-mazurskie",,,4 pokoje,"89,82 m²",Inwestycja deweloperska,/pl/oferta/bianco-mieszkanie-4-pok-m18-ID4jWDP,01/16/24
