free_text,address,price,price_meter,rooms,area,more,add_link,scraping_date
Parter! Dwa pokoje w Gutkowie do własnej aranżacji,"Mieszkanie na sprzedaż: ul. Sokola, Gutkowo, Olsztyn, warmińsko-mazurskie",320 000 zł,8961 zł/m²,2 pokoje,"35,71 m²",Biuro nieruchomości,/pl/oferta/parter-dwa-pokoje-w-gutkowie-do-wlasnej-aranzacji-ID4ovSS,2024-01-16
!!! Mieszkanie Położone Między Dwoma Jeziorami !!!,"Mieszkanie na sprzedaż: ul. Rybaki, Osiedle Nad Jeziorem Długim, Olsztyn, warmińsko-mazurskie",650 000 zł,10 383 zł/m²,3 pokoje,"62,6 m²",Biuro nieruchomości,/pl/oferta/mieszkanie-polozone-miedzy-dwoma-jeziorami-ID4lDiN,2024-01-16
"Kołobrzeska 13H, Dwa pokoje, 1 piętro","Mieszkanie na sprzedaż: ul. Kołobrzeska, Pojezierze, Olsztyn, warmińsko-mazurskie",274 000 zł,7062 zł/m²,2 pokoje,"38,8 m²",Biuro nieruchomości,/pl/oferta/kolobrzeska-13h-dwa-pokoje-1-pietro-ID4ovrK,2024-01-16
"Nowe budow. 3 pokoje, winda, Borowa","Mieszkanie na sprzedaż: ul. Borowa, Podleśna, Olsztyn, warmińsko-mazurskie",529 000 zł,10 173 zł/m²,3 pokoje,52 m²,Biuro nieruchomości,/pl/oferta/nowe-budow-3-pokoje-winda-borowa-ID4obK0,2024-01-16
"Mieszkanie 2 pokoje, ul. Mroza, os.Jaroty, Olsztyn","Mieszkanie na sprzedaż: ul. Edwarda Mroza, Jaroty, Olsztyn, warmińsko-mazurskie",495 000 zł,10 280 zł/m²,2 pokoje,"48,15 m²",Biuro nieruchomości,/pl/oferta/mieszkanie-2-pokoje-ul-mroza-os-jaroty-olsztyn-ID4ovgz,2024-01-16
"Stylowe mieszkanie 49,6 m2, gotowe do zamieszkania","Mieszkanie na sprzedaż: ul. Mieczysława Niedziałkowskiego, Zatorze, Olsztyn, warmińsko-mazurskie",419 000 zł,8448 zł/m²,2 pokoje,"49,6 m²","49,6 m²",/pl/oferta/stylowe-mieszkanie-49-6-m2-gotowe-do-zamieszkania-ID4ov8t,2024-01-16
Nowy Apartament Zatoka Apartamenty A140 z tarasem,"Mieszkanie na sprzedaż: Dajtki, Olsztyn, warmińsko-mazurskie",,,2 pokoje,"40,72 m²",Inwestycja deweloperska,/pl/oferta/nowy-apartament-zatoka-apartamenty-a140-z-tarasem-ID4hgYx,2024-01-16
Mieszkanie z miejscem parkingowym ul Jarocka,"Mieszkanie na sprzedaż: Jaroty, Olsztyn, warmińsko-mazurskie",435 000 zł,12 612 zł/m²,2 pokoje,"34,49 m²","34,49 m²",/pl/oferta/mieszkanie-z-miejscem-parkingowym-ul-jarocka-ID4owPV,2024-01-16
"3 pokoje, 60 M , Turkowskiego, Pieczewo","Mieszkanie na sprzedaż: ul. Leonarda Turkowskiego, Pieczewo, Olsztyn, warmińsko-mazurskie",389 000 zł,6538 zł/m²,3 pokoje,"59,5 m²",Biuro nieruchomości,/pl/oferta/3-pokoje-60-m-turkowskiego-pieczewo-ID4owJd,2024-01-16
Os. Leśna| 4-pokojowe mieszkanie A.III/44,"Mieszkanie na sprzedaż: ul. Leśna, Osiedle Nad Jeziorem Długim, Olsztyn, warmińsko-mazurskie",,,4 pokoje,"86,87 m²",Inwestycja deweloperska,/pl/oferta/os-lesna-4-pokojowe-mieszkanie-a-iii-44-ID4bpA9,2024-01-16
"46,5m - 2pokoje + salon z aneksem na Jarotach","Mieszkanie na sprzedaż: ul. Juliana Dadleza, Jaroty, Olsztyn, warmińsko-mazurskie",425 000 zł,9140 zł/m²,3 pokoje,"46,5 m²","46,5 m²",/pl/oferta/46-5m-2pokoje-salon-z-aneksem-na-jarotach-ID4iYKy,2024-01-16
"Osiedle Belweder - 3 pokoje + komórka 8,57 m2","Mieszkanie na sprzedaż: ul. ks. Jerzego Popiełuszki, Osiedle Generałów, Olsztyn, warmińsko-mazurskie",517 000 zł,9942 zł/m²,3 pokoje,52 m²,52 m²,/pl/oferta/osiedle-belweder-3-pokoje-komorka-8-57-m2-ID4ma5O,2024-01-16
A.31 2-pokojowy apartament przy jeziorze Ukiel,"Mieszkanie na sprzedaż: ul. Sielska, Dajtki, Olsztyn, warmińsko-mazurskie",613 770 zł,18 454 zł/m²,2 pokoje,"33,26 m²",Inwestycja deweloperska,/pl/oferta/a-31-2-pokojowy-apartament-przy-jeziorze-ukiel-ID4kZwI,2024-01-16
Nowy Apartament Zatoka Apartamenty | A338,"Mieszkanie na sprzedaż: Dajtki, Olsztyn, warmińsko-mazurskie",,,2 pokoje,"32,76 m²",Inwestycja deweloperska,/pl/oferta/nowy-apartament-zatoka-apartamenty-a338-ID4hgzT,2024-01-16
Apartamenty Wyzwolenia | apartament nr 1,"Mieszkanie na sprzedaż: ul. Wyzwolenia, Śródmieście, Olsztyn, warmińsko-mazurskie",459 510 zł,10 600 zł/m²,1 pokój,"43,35 m²",Inwestycja deweloperska,/pl/oferta/apartamenty-wyzwolenia-apartament-nr-1-ID4nyyd,2024-01-16
Mieszkanie ul.Reymonta 49,"Mieszkanie na sprzedaż: ul. Władysława Reymonta 49, Podleśna, Olsztyn, warmińsko-mazurskie",418 000 zł,8989 zł/m²,2 pokoje,"46,5 m²","46,5 m²",/pl/oferta/mieszkanie-ul-reymonta-49-ID4o3B8,2024-01-16
Mieszkanie Rataja 62,"Mieszkanie na sprzedaż: ul. Macieja Rataja 62, Podleśna, Olsztyn, warmińsko-mazurskie",315 000 zł,10 328 zł/m²,2 pokoje,"30,5 m²","30,5 m²",/pl/oferta/mieszkanie-rataja-62-ID4o3A4,2024-01-16
"Mieszkanie 2 pokojowe z oddzielną kuchnią-Olsztyn,","Mieszkanie na sprzedaż: ul. Juliana Dadleza, Jaroty, Olsztyn, warmińsko-mazurskie",505 000 zł,11 197 zł/m²,2 pokoje,"45,1 m²","45,1 m²",/pl/oferta/mieszkanie-2-pokojowe-z-oddzielna-kuchnia-olsztyn-ID4ouPh,2024-01-16
Apartament inwestycyjny nad jeziorem Ukiel,"Mieszkanie na sprzedaż: Dajtki, Olsztyn, warmińsko-mazurskie",637 000 zł,19 480 zł/m²,2 pokoje,"32,7 m²",Biuro nieruchomości,/pl/oferta/apartament-inwestycyjny-nad-jeziorem-ukiel-ID4o74z,2024-01-16
"Os. Aurora, M134, duży taras, oddzielna kuchnia","Mieszkanie na sprzedaż: ul. Franciszka Barcza 50, Nagórki, Olsztyn, warmińsko-mazurskie",772 680 zł,12 000 zł/m²,3 pokoje,"64,39 m²",Inwestycja deweloperska,/pl/oferta/os-aurora-m134-duzy-taras-oddzielna-kuchnia-ID4evYW,2024-01-16
Apartament Premium z34metrowym tarasem,"Mieszkanie na sprzedaż: ul. Franciszka Barcza, Nagórki, Olsztyn, warmińsko-mazurskie",1 120 000 zł,16 232 zł/m²,3 pokoje,69 m²,69 m²,/pl/oferta/apartament-premium-z34metrowym-tarasem-ID4kQCk,2024-01-16
Apartament 3 pokoje + 2 miejsca w garażu,"Mieszkanie na sprzedaż: Śródmieście, Olsztyn, warmińsko-mazurskie",719 000 zł,12 614 zł/m²,3 pokoje,57 m²,57 m²,/pl/oferta/apartament-3-pokoje-2-miejsca-w-garazu-ID4o2Sj,2024-01-16
Nowy apartament A143 z widokiem bocznym na jezioro,"Mieszkanie na sprzedaż: Dajtki, Olsztyn, warmińsko-mazurskie",,,2 pokoje,"32,76 m²",Inwestycja deweloperska,/pl/oferta/nowy-apartament-a143-z-widokiem-bocznym-na-jezioro-ID4hgXy,2024-01-16
Apartamenty Wyzwolenia | apartament nr 39,"Mieszkanie na sprzedaż: ul. Wyzwolenia, Śródmieście, Olsztyn, warmińsko-mazurskie",453 096 zł,10 850 zł/m²,2 pokoje,"41,76 m²",Inwestycja deweloperska,/pl/oferta/apartamenty-wyzwolenia-apartament-nr-39-ID4nyyb,2024-01-16
Lokal/Apartament 120m w samym centrum Olsztyna !,"Mieszkanie na sprzedaż: ul. Wyzwolenia 32, Śródmieście, Olsztyn, warmińsko-mazurskie",895 000 zł,7458 zł/m²,4 pokoje,120 m²,120 m²,/pl/oferta/lokal-apartament-120m-w-samym-centrum-olsztyna-ID4lXvo,2024-01-16
Apartamenty Wyzwolenia | apartament nr 40,"Mieszkanie na sprzedaż: ul. Wyzwolenia, Śródmieście, Olsztyn, warmińsko-mazurskie",467 310 zł,10 850 zł/m²,1 pokój,"43,07 m²",Inwestycja deweloperska,/pl/oferta/apartamenty-wyzwolenia-apartament-nr-40-ID4nyya,2024-01-16
Warszawska99 | mieszkanie 3-pok. | 33,"Mieszkanie na sprzedaż: al. Aleja Warszawska, Kortowo, Olsztyn, warmińsko-mazurskie",,,3 pokoje,"60,74 m²",Inwestycja deweloperska,/pl/oferta/warszawska99-mieszkanie-3-pok-33-ID4nu3Z,2024-01-16
Apartamenty Wyzwolenia | apartament nr 37,"Mieszkanie na sprzedaż: ul. Wyzwolenia, Śródmieście, Olsztyn, warmińsko-mazurskie",458 413 zł,10 850 zł/m²,2 pokoje,"42,25 m²",Inwestycja deweloperska,/pl/oferta/apartamenty-wyzwolenia-apartament-nr-37-ID4nyy9,2024-01-16
Mieszkanie na sprzedaż Olsztyn Jaroty Stawigudzka,"Mieszkanie na sprzedaż: Jaroty, Olsztyn, warmińsko-mazurskie",449 000 zł,8315 zł/m²,2 pokoje,54 m²,54 m²,/pl/oferta/mieszkanie-na-sprzedaz-olsztyn-jaroty-stawigudzka-ID4ou2C,2024-01-16
2-pokojowe mieszkanie Olsztyn - Nagórki,"Mieszkanie na sprzedaż: ul. Franciszka Barcza, Nagórki, Olsztyn, warmińsko-mazurskie",390 000 zł,8008 zł/m²,2 pokoje,"48,7 m²",Biuro nieruchomości,/pl/oferta/2-pokojowe-mieszkanie-olsztyn-nagorki-ID4otTA,2024-01-16
Mieszkanie - 3 pokoje - Centrum,"Mieszkanie na sprzedaż: ul. Kolejowa, Zatorze, Olsztyn, warmińsko-mazurskie",445 000 zł,7946 zł/m²,3 pokoje,56 m²,Biuro nieruchomości,/pl/oferta/mieszkanie-3-pokoje-centrum-ID4otTB,2024-01-16
"Mieszkanie na sprzedaż , Olsztyn, ul. Olimpijska","Mieszkanie na sprzedaż: Olimpijska, Likusy, Olsztyn, warmińsko-mazurskie",550 000 zł,19 455 zł/m²,2 pokoje,"28,27 m²",Biuro nieruchomości,/pl/oferta/mieszkanie-na-sprzedaz-olsztyn-ul-olimpijska-ID4nRvl,2024-01-16
Dwupokojowe mieszkanie w atrakcyjnej lokalizacji,"Mieszkanie na sprzedaż: ul. Mieczysława Orłowicza, Nagórki, Olsztyn, warmińsko-mazurskie",299 000 zł,6190 zł/m²,2 pokoje,"48,3 m²",Biuro nieruchomości,/pl/oferta/dwupokojowe-mieszkanie-w-atrakcyjnej-lokalizacji-ID4npdz,2024-01-16
Na sprzedaż atrakcyjna nieruchomość na Jarotach,"Mieszkanie na sprzedaż: ul. ks. Jana Hanowskiego, Jaroty, Olsztyn, warmińsko-mazurskie",229 000 zł,6203 zł/m²,2 pokoje,"36,92 m²",Biuro nieruchomości,/pl/oferta/na-sprzedaz-atrakcyjna-nieruchomosc-na-jarotach-ID4nk3Z,2024-01-16
Klimatyczne mieszkanie w centrum miasta,"Mieszkanie na sprzedaż: ul. Adama Mickiewicza, Osiedle Kościuszki, Olsztyn, warmińsko-mazurskie",369 000 zł,7365 zł/m²,2 pokoje,"50,1 m²",Biuro nieruchomości,/pl/oferta/klimatyczne-mieszkanie-w-centrum-miasta-ID4jIE2,2024-01-16
"Mieszkanie W Kamienicy 90 m2, 4 pokoje","Mieszkanie na sprzedaż: ul. Marii Zientary-Malewskiej, Podleśna, Olsztyn, warmińsko-mazurskie",399 000 zł,4433 zł/m²,4 pokoje,90 m²,Biuro nieruchomości,/pl/oferta/mieszkanie-w-kamienicy-90-m2-4-pokoje-ID4nq72,2024-01-16
"Przestronne, komfortowe mieszkanie po remoncie.","Mieszkanie na sprzedaż: ul. Henryka Sienkiewicza, Zatorze, Olsztyn, warmińsko-mazurskie",455 000 zł,8922 zł/m²,2 pokoje,51 m²,51 m²,/pl/oferta/przestronne-komfortowe-mieszkanie-po-remoncie-ID4otFE,2024-01-16
"68m2 , kuchnia osobna, możliwość dokupienia garażu","Mieszkanie na sprzedaż: Stawigudzka 14, Jaroty, Olsztyn, warmińsko-mazurskie",530 000 zł,7768 zł/m²,3 pokoje,"68,23 m²","68,23 m²",/pl/oferta/68m2-kuchnia-osobna-mozliwosc-dokupienia-garazu-ID4naUN,2024-01-16
Apartamenty Wyzwolenia | apartament nr 36,"Mieszkanie na sprzedaż: ul. Wyzwolenia, Śródmieście, Olsztyn, warmińsko-mazurskie",453 096 zł,10 850 zł/m²,2 pokoje,"41,76 m²",Inwestycja deweloperska,/pl/oferta/apartamenty-wyzwolenia-apartament-nr-36-ID4nyy8,2024-01-16
Kołobrzeska 36B / 4 pokoje / 83 m2,"Mieszkanie na sprzedaż: ul. Kołobrzeska 36B, Pojezierze, Olsztyn, warmińsko-mazurskie","602 591,40 zł",7290 zł/m²,4 pokoje,"82,66 m²",Inwestycja deweloperska,/pl/oferta/kolobrzeska-36b-4-pokoje-83-m2-ID4jeEr,2024-01-16
"Browary Park, 54m2, 2 pokoje, garaż, balkon","Mieszkanie na sprzedaż: al. Aleja Wojska Polskiego 20, Osiedle Wojska Polskiego, Olsztyn, warmińsko-mazurskie",699 000 zł,12 944 zł/m²,2 pokoje,54 m²,54 m²,/pl/oferta/browary-park-54m2-2-pokoje-garaz-balkon-ID4oh5F,2024-01-16
"Nowe mieszkanie - 2 pokoje, 2 piętro - Flisa 6","Mieszkanie na sprzedaż: Flisa Marcina, Jaroty, Olsztyn, warmińsko-mazurskie",465 000 zł,10 936 zł/m²,2 pokoje,"42,52 m²",Biuro nieruchomości,/pl/oferta/nowe-mieszkanie-2-pokoje-2-pietro-flisa-6-ID4otdX,2024-01-16
Wilczyńskiego 6 - 3 pokoje na 3 p. po remoncie,"Mieszkanie na sprzedaż: ul. Biskupa Tomasza Wilczyńskiego, Jaroty, Olsztyn, warmińsko-mazurskie",509 000 zł,8157 zł/m²,3 pokoje,"62,4 m²",Biuro nieruchomości,/pl/oferta/wilczynskiego-6-3-pokoje-na-3-p-po-remoncie-ID4otdS,2024-01-16
"Osiedle Aurora, M58, taras, panoramiczne okna","Mieszkanie na sprzedaż: ul. Franciszka Barcza 50, Nagórki, Olsztyn, warmińsko-mazurskie",1 092 240 zł,12 000 zł/m²,4 pokoje,"91,02 m²",Inwestycja deweloperska,/pl/oferta/osiedle-aurora-m58-taras-panoramiczne-okna-ID4evWa,2024-01-16
REZERWACJA mieszkanie 2 pokoje centrum Jarot,"Mieszkanie na sprzedaż: ul. Jana Janowicza 5, Jaroty, Olsztyn, warmińsko-mazurskie",420 000 zł,9859 zł/m²,2 pokoje,"42,6 m²",Biuro nieruchomości,/pl/oferta/rezerwacja-mieszkanie-2-pokoje-centrum-jarot-ID4osXy,2024-01-16
Mieszkanie 2 pok. na ul. Warszawskiej - Rezerwacja,"Mieszkanie na sprzedaż: al. Aleja Warszawska, Podgrodzie, Olsztyn, warmińsko-mazurskie",369 000 zł,8732 zł/m²,2 pokoje,"42,26 m²",Biuro nieruchomości,/pl/oferta/mieszkanie-2-pok-na-ul-warszawskiej-rezerwacja-ID4osPr,2024-01-16
Apartamenty Wyzwolenia | apartament nr 33,"Mieszkanie na sprzedaż: ul. Wyzwolenia, Śródmieście, Olsztyn, warmińsko-mazurskie",596 500 zł,10 000 zł/m²,3 pokoje,"59,65 m²",Inwestycja deweloperska,/pl/oferta/apartamenty-wyzwolenia-apartament-nr-33-ID4nyy7,2024-01-16
Mieszkanie w szeregowcu ul. Gołębia blisko jeziora,"Mieszkanie na sprzedaż: ul. Gołębia, Gutkowo, Olsztyn, warmińsko-mazurskie",699 000 zł,7061 zł/m²,4 pokoje,99 m²,99 m²,/pl/oferta/mieszkanie-w-szeregowcu-ul-golebia-blisko-jeziora-ID4oszO,2024-01-16
Atrakcyjne 3 pokojowe mieszkanie,"Mieszkanie na sprzedaż: ul. Wojciecha Kętrzyńskiego, Osiedle Kętrzyńskiego, Olsztyn, warmińsko-mazurskie",430 000 zł,7283 zł/m²,3 pokoje,"59,04 m²",Biuro nieruchomości,/pl/oferta/atrakcyjne-3-pokojowe-mieszkanie-ID4osq7,2024-01-16
"Olsztyn, Pojezierze 48,5m2, BEZ POŚREDNIKÓW!","Mieszkanie na sprzedaż: ul. Kołobrzeska, Pojezierze, Olsztyn, warmińsko-mazurskie",358 000 zł,7381 zł/m²,3 pokoje,"48,5 m²","48,5 m²",/pl/oferta/olsztyn-pojezierze-48-5m2-bez-posrednikow-ID4osno,2024-01-16
MIESZKANIE DWUPOKOJOWE W ODRESTAUROWANEJ KAMIENICY,"Mieszkanie na sprzedaż: Zatorze, Olsztyn, warmińsko-mazurskie",590 000 zł,9449 zł/m²,2 pokoje,"62,44 m²",Biuro nieruchomości,/pl/oferta/mieszkanie-dwupokojowe-w-odrestaurowanej-kamienicy-ID4maSs,2024-01-16
przestronne mieszkanie w centrum olsztyna,"Mieszkanie na sprzedaż: Śródmieście, Olsztyn, warmińsko-mazurskie",790 000 zł,8876 zł/m²,3 pokoje,89 m²,Biuro nieruchomości,/pl/oferta/przestronne-mieszkanie-w-centrum-olsztyna-ID4mei9,2024-01-16
Mieszkanie w zabudowie szeregowej os.Generałów Ols,"Mieszkanie na sprzedaż: Osiedle Generałów, Olsztyn, warmińsko-mazurskie",729 000 zł,7674 zł/m²,3 pokoje,95 m²,Biuro nieruchomości,/pl/oferta/mieszkanie-w-zabudowie-szeregowej-os-generalow-ols-ID4o1m1,2024-01-16
Mieszkanie 3-pokojowe Jaroty,"Mieszkanie na sprzedaż: Jaroty, Olsztyn, warmińsko-mazurskie",440 000 zł,7333 zł/m²,3 pokoje,60 m²,Biuro nieruchomości,/pl/oferta/mieszkanie-3-pokojowe-jaroty-ID4o1nR,2024-01-16
Apartament Fregata Park,"Mieszkanie na sprzedaż: ul. Augustowska, Osiedle Mazurskie, Olsztyn, warmińsko-mazurskie",540 000 zł,9751 zł/m²,2 pokoje,"55,38 m²",Biuro nieruchomości,/pl/oferta/apartament-fregata-park-ID4o1pQ,2024-01-16
"Dwupoziomowe - 4 pokoje, przy lesie","Mieszkanie na sprzedaż: ul. Biskupa Tomasza Wilczyńskiego, Jaroty, Olsztyn, warmińsko-mazurskie",529 000 zł,6260 zł/m²,4 pokoje,"84,5 m²",Biuro nieruchomości,/pl/oferta/dwupoziomowe-4-pokoje-przy-lesie-ID4o3OI,2024-01-16
Centrum Bema dwa pokoje trzecie piętro 50 m2,"Mieszkanie na sprzedaż: pl. Plac gen. Józefa Bema, Osiedle Kętrzyńskiego, Olsztyn, warmińsko-mazurskie",429 000 zł,8597 zł/m²,2 pokoje,"49,9 m²",Biuro nieruchomości,/pl/oferta/centrum-bema-dwa-pokoje-trzecie-pietro-50-m2-ID4os0y,2024-01-16
5 pokojowe mieszkanie na Jarotach,"Mieszkanie na sprzedaż: ul. Jerzego Burskiego, Jaroty, Olsztyn, warmińsko-mazurskie",749 000 zł,7778 zł/m²,5 pokoi,"96,3 m²",Biuro nieruchomości,/pl/oferta/5-pokojowe-mieszkanie-na-jarotach-ID4orZG,2024-01-16
Mieszkanie w Centrum,"Mieszkanie na sprzedaż: ul. Grunwaldzka, Śródmieście, Olsztyn, warmińsko-mazurskie",329 000 zł,8797 zł/m²,2 pokoje,"37,4 m²",Biuro nieruchomości,/pl/oferta/mieszkanie-w-centrum-ID4orZ4,2024-01-16
Osiedle Belweder - 50m2 UMOWA PRZEDWSTĘPNA,"Mieszkanie na sprzedaż: ul. ks. Jerzego Popiełuszki, Osiedle Generałów, Olsztyn, warmińsko-mazurskie",499 000 zł,9980 zł/m²,2 pokoje,50 m²,Biuro nieruchomości,/pl/oferta/osiedle-belweder-50m2-umowa-przedwstepna-ID4ohaC,2024-01-16
4 pokoje / salon z aneksem 30 m2 / Kołobrzeska 36B,"Mieszkanie na sprzedaż: ul. Kołobrzeska 36B, Pojezierze, Olsztyn, warmińsko-mazurskie","602 737,70 zł",7190 zł/m²,4 pokoje,"83,83 m²",Inwestycja deweloperska,/pl/oferta/4-pokoje-salon-z-aneksem-30-m2-kolobrzeska-36b-ID490Xz,2024-01-16
Apartamenty Wyzwolenia | apartament nr 31,"Mieszkanie na sprzedaż: ul. Wyzwolenia, Śródmieście, Olsztyn, warmińsko-mazurskie",461 448 zł,11 050 zł/m²,2 pokoje,"41,76 m²",Inwestycja deweloperska,/pl/oferta/apartamenty-wyzwolenia-apartament-nr-31-ID4nyy6,2024-01-16
Taras 23m2 / 3 przestronne pokoje / Kołobrzeska,"Mieszkanie na sprzedaż: ul. Kołobrzeska 36B, Pojezierze, Olsztyn, warmińsko-mazurskie","629 657,20 zł",7690 zł/m²,3 pokoje,"81,88 m²",Inwestycja deweloperska,/pl/oferta/taras-23m2-3-przestronne-pokoje-kolobrzeska-ID4915M,2024-01-16
Kołobrzeska 36B Olsztyn / 4 pokoje / 82 m2,"Mieszkanie na sprzedaż: ul. Kołobrzeska 36B, Pojezierze, Olsztyn, warmińsko-mazurskie",592 456 zł,7190 zł/m²,4 pokoje,"82,4 m²",Inwestycja deweloperska,/pl/oferta/kolobrzeska-36b-olsztyn-4-pokoje-82-m2-ID490ZS,2024-01-16
Os. Leśna | 2 - pokojowe mieszkanie A.III/37,"Mieszkanie na sprzedaż: ul. Leśna, Osiedle Nad Jeziorem Długim, Olsztyn, warmińsko-mazurskie",,,2 pokoje,"45,16 m²",Inwestycja deweloperska,/pl/oferta/os-lesna-2-pokojowe-mieszkanie-a-iii-37-ID4bpBq,2024-01-16
Mieszkanie bezczynszowe z własnym ogródkiem,"Mieszkanie na sprzedaż: Gutkowo, Olsztyn, warmińsko-mazurskie",650 000 zł,7306 zł/m²,4 pokoje,"88,97 m²",Inwestycja deweloperska,/pl/oferta/mieszkanie-bezczynszowe-z-wlasnym-ogrodkiem-ID4giRw,2024-01-16
Apartamenty Wyzwolenia | apartament nr 60,"Mieszkanie na sprzedaż: ul. Wyzwolenia, Śródmieście, Olsztyn, warmińsko-mazurskie",517 824 zł,12 400 zł/m²,2 pokoje,"41,76 m²",Inwestycja deweloperska,/pl/oferta/apartamenty-wyzwolenia-apartament-nr-60-ID4nyy4,2024-01-16
Warszawska99 | mieszkanie 2-pok. | 10,"Mieszkanie na sprzedaż: al. Aleja Warszawska, Kortowo, Olsztyn, warmińsko-mazurskie",,,2 pokoje,"46,23 m²",Inwestycja deweloperska,/pl/oferta/warszawska99-mieszkanie-2-pok-10-ID4nu6s,2024-01-16
Mieszkanie Kętrzyńskiego,"Mieszkanie na sprzedaż: ul. Wojciecha Kętrzyńskiego, Osiedle Kętrzyńskiego, Olsztyn, warmińsko-mazurskie",465 000 zł,6643 zł/m²,4 pokoje,70 m²,Biuro nieruchomości,/pl/oferta/mieszkanie-ketrzynskiego-ID4m1Es,2024-01-16
Mieszkanie na sprzedaż 56m2-Olsztyn centrum,"Mieszkanie na sprzedaż: Zatorze, Olsztyn, warmińsko-mazurskie",460 000 zł,8214 zł/m²,3 pokoje,56 m²,Biuro nieruchomości,/pl/oferta/mieszkanie-na-sprzedaz-56m2-olsztyn-centrum-ID4okzf,2024-01-16
Mieszkanie na 1 piętrze Olsztyn,"Mieszkanie na sprzedaż: ul. Kardynała Stefana Wyszyńskiego, Kormoran, Olsztyn, warmińsko-mazurskie",380 000 zł,10 000 zł/m²,2 pokoje,38 m²,Biuro nieruchomości,/pl/oferta/mieszkanie-na-1-pietrze-olsztyn-ID4orr3,2024-01-16
Apartament Bezczynszowy 90m od jeziora Ukiel,"Mieszkanie na sprzedaż: ul. Pawia, Gutkowo, Olsztyn, warmińsko-mazurskie",590 000 zł,5268 zł/m²,5 pokoi,112 m²,Biuro nieruchomości,/pl/oferta/apartament-bezczynszowy-90m-od-jeziora-ukiel-ID4nUIL,2024-01-16
"Mieszkanie 51m2, Olsztyn, ul. Armii Krajowej","Mieszkanie na sprzedaż: ul. Armii Krajowej, Osiedle Grunwaldzkie, Olsztyn, warmińsko-mazurskie",595 000 zł,11 667 zł/m²,2 pokoje,51 m²,Biuro nieruchomości,/pl/oferta/mieszkanie-51m2-olsztyn-ul-armii-krajowej-ID4nW5O,2024-01-16
Mieszkanie - Olsztyn,"Mieszkanie na sprzedaż: ul. ks. Wacława Osińskiego, Podgrodzie, Olsztyn, warmińsko-mazurskie",367 290 zł,7573 zł/m²,2 pokoje,"48,5 m²",Biuro nieruchomości,/pl/oferta/mieszkanie-olsztyn-ID4or18,2024-01-16
2 pokojowe mieszkanie na Jarotach!,"Mieszkanie na sprzedaż: Jaroty, Olsztyn, warmińsko-mazurskie",399 000 zł,6867 zł/m²,2 pokoje,"58,1 m²",Biuro nieruchomości,/pl/oferta/2-pokojowe-mieszkanie-na-jarotach-ID4or02,2024-01-16
Mieszkanie na zamkniętym osiedlu Barcza | 3 pokoje,"Mieszkanie na sprzedaż: ul. Franciszka Barcza, Nagórki, Olsztyn, warmińsko-mazurskie",554 000 zł,8816 zł/m²,3 pokoje,"62,84 m²",Biuro nieruchomości,/pl/oferta/mieszkanie-na-zamknietym-osiedlu-barcza-3-pokoje-ID4oqQz,2024-01-16
"Iwaszkiewicza - 3 pokoje, 1 piętro","Mieszkanie na sprzedaż: ul. Jarosława Iwaszkiewicza, Podgrodzie, Olsztyn, warmińsko-mazurskie",449 000 zł,7496 zł/m²,3 pokoje,"59,9 m²",Biuro nieruchomości,/pl/oferta/iwaszkiewicza-3-pokoje-1-pietro-ID4oqFp,2024-01-16
"Mieszkanie 63,8 m2 idealne dla rodziny","Mieszkanie na sprzedaż: ul. Majora Henryka Sucharskiego, Osiedle Generałów, Olsztyn, warmińsko-mazurskie",499 000 zł,7821 zł/m²,3 pokoje,"63,8 m²",Biuro nieruchomości,/pl/oferta/mieszkanie-63-8-m2-idealne-dla-rodziny-ID4nPIB,2024-01-16
"Mieszkanie W Kamienicy Na Parterze, Centrum","Mieszkanie na sprzedaż: ul. Bolesława Prusa, Osiedle Wojska Polskiego, Olsztyn, warmińsko-mazurskie",579 000 zł,4772 zł/m²,4 pokoje,"121,34 m²",Biuro nieruchomości,/pl/oferta/mieszkanie-w-kamienicy-na-parterze-centrum-ID4lyln,2024-01-16
Mieszkanie w ścisłym Centrum Olsztyna,"Mieszkanie na sprzedaż: ul. Grunwaldzka, Śródmieście, Olsztyn, warmińsko-mazurskie",329 000 zł,8797 zł/m²,1 pokój,"37,4 m²",Biuro nieruchomości,/pl/oferta/mieszkanie-w-scislym-centrum-olsztyna-ID4oqrK,2024-01-16
"Mieszkanie 2 pokojowe, Iwaszkiewicza 10, Olsztyn","Mieszkanie na sprzedaż: ul. Jarosława Iwaszkiewicza, Podgrodzie, Olsztyn, warmińsko-mazurskie",419 000 zł,8928 zł/m²,2 pokoje,"46,93 m²",Biuro nieruchomości,/pl/oferta/mieszkanie-2-pokojowe-iwaszkiewicza-10-olsztyn-ID4obBF,2024-01-16
"Mieszkanie, 65 m², Olsztyn","Mieszkanie na sprzedaż: ul. Jarocka, Jaroty, Olsztyn, warmińsko-mazurskie",403 000 zł,6200 zł/m²,3 pokoje,65 m²,Biuro nieruchomości,/pl/oferta/mieszkanie-65-m-olsztyn-ID4nHK0,2024-01-16
Apartamenty Wyzwolenia | apartament nr 9,"Mieszkanie na sprzedaż: ul. Wyzwolenia, Śródmieście, Olsztyn, warmińsko-mazurskie",590 304 zł,10 400 zł/m²,3 pokoje,"56,76 m²",Inwestycja deweloperska,/pl/oferta/apartamenty-wyzwolenia-apartament-nr-9-ID4cgUe,2024-01-16
Dwupokojowe mieszkanie blisko centrum miasta,"Mieszkanie na sprzedaż: ul. Dworcowa, Kormoran, Olsztyn, warmińsko-mazurskie",299 000 zł,8352 zł/m²,2 pokoje,"35,8 m²",Biuro nieruchomości,/pl/oferta/dwupokojowe-mieszkanie-blisko-centrum-miasta-ID4opYr,2024-01-16
"Dwa pokoje, 39 m2, Popiełuszki,osiedle Generałów","Mieszkanie na sprzedaż: ul. ks. Jerzego Popiełuszki, Osiedle Generałów, Olsztyn, warmińsko-mazurskie",430 000 zł,10 916 zł/m²,2 pokoje,"39,39 m²",Biuro nieruchomości,/pl/oferta/dwa-pokoje-39-m2-popieluszki-osiedle-generalow-ID4opJo,2024-01-16
"Mieszkanie, 35,80 m², Olsztyn","Mieszkanie na sprzedaż: Nagórki, Olsztyn, warmińsko-mazurskie",289 000 zł,8073 zł/m²,2 pokoje,"35,8 m²",Biuro nieruchomości,/pl/oferta/mieszkanie-35-80-m-olsztyn-ID4opIF,2024-01-16
Apartamenty Wyzwolenia | atrakcyjny apartament,"Mieszkanie na sprzedaż: ul. Wyzwolenia, Śródmieście, Olsztyn, warmińsko-mazurskie",911 508 zł,10 850 zł/m²,3 pokoje,"84,01 m²",Inwestycja deweloperska,/pl/oferta/apartamenty-wyzwolenia-atrakcyjny-apartament-ID4cfU4,2024-01-16
Sucharskiego 4 - 2 pokoje z oddzielną kuchnią,"Mieszkanie na sprzedaż: ul. Majora Henryka Sucharskiego, Osiedle Generałów, Olsztyn, warmińsko-mazurskie",385 000 zł,8953 zł/m²,2 pokoje,43 m²,Biuro nieruchomości,/pl/oferta/sucharskiego-4-2-pokoje-z-oddzielna-kuchnia-ID4opfO,2024-01-16
2 pokoje z oddzielną kuchnią - Jaroty,"Mieszkanie na sprzedaż: ul. Pieczewska, Jaroty, Olsztyn, warmińsko-mazurskie",339 000 zł,9549 zł/m²,2 pokoje,"35,5 m²",Biuro nieruchomości,/pl/oferta/2-pokoje-z-oddzielna-kuchnia-jaroty-ID4op4H,2024-01-16
"Versal - Armii Krajowej 3, przy plaży i Uwm","Mieszkanie na sprzedaż: Armii Krajowej al., Osiedle Grunwaldzkie, Olsztyn, warmińsko-mazurskie",595 000 zł,11 667 zł/m²,2 pokoje,51 m²,Biuro nieruchomości,/pl/oferta/versal-armii-krajowej-3-przy-plazy-i-uwm-ID4op4D,2024-01-16
Apartamenty Wyzwolenia | apartament nr 62,"Mieszkanie na sprzedaż: ul. Wyzwolenia, Śródmieście, Olsztyn, warmińsko-mazurskie",498 976 zł,12 400 zł/m²,2 pokoje,"40,24 m²",Inwestycja deweloperska,/pl/oferta/apartamenty-wyzwolenia-apartament-nr-62-ID4nyy3,2024-01-16
Mieszkanie z potencjałem: Twoje okno na świat,"Mieszkanie na sprzedaż: ul. Mieczysława Orłowicza, Nagórki, Olsztyn, warmińsko-mazurskie",435 000 zł,5975 zł/m²,4 pokoje,"72,8 m²",Biuro nieruchomości,/pl/oferta/mieszkanie-z-potencjalem-twoje-okno-na-swiat-ID4o2ME,2024-01-16
"Mieszkanie, 48,10 m², Olsztyn","Mieszkanie na sprzedaż: Pojezierze, Olsztyn, warmińsko-mazurskie",419 000 zł,8711 zł/m²,3 pokoje,"48,1 m²",Biuro nieruchomości,/pl/oferta/mieszkanie-48-10-m-olsztyn-ID4oozt,2024-01-16
Apartamenty Wyzwolenia | apartament nr 52,"Mieszkanie na sprzedaż: ul. Wyzwolenia, Śródmieście, Olsztyn, warmińsko-mazurskie",700 724 zł,12 400 zł/m²,3 pokoje,"56,51 m²",Inwestycja deweloperska,/pl/oferta/apartamenty-wyzwolenia-apartament-nr-52-ID4nyxX,2024-01-16
"ul.Boenigka 32, 35,9m2,2pok.IIp./IVp., balkon - Do","Mieszkanie na sprzedaż: ul. Jana Boenigka, Jaroty, Olsztyn, warmińsko-mazurskie",365 000 zł,10 139 zł/m²,2 pokoje,36 m²,Biuro nieruchomości,/pl/oferta/ul-boenigka-32-35-9m2-2pok-iip-ivp-balkon-do-ID4n3uL,2024-01-16
mieszkanie 3 pokoje Olsztyn- Pieczewo ul. Gębika,"Mieszkanie na sprzedaż: ul. Władysława Gębika, Pieczewo, Olsztyn, warmińsko-mazurskie",465 000 zł,8675 zł/m²,3 pokoje,"53,6 m²",Biuro nieruchomości,/pl/oferta/mieszkanie-3-pokoje-olsztyn-pieczewo-ul-gebika-ID4onBx,2024-01-16
