free_text,address,price,price_meter,rooms,area,more,add_link,scraping_date
"2-pokojowe mieszkanie, gotowe do zamieszkania","Mieszkanie na sprzedaż: ul. Jana Żiżki, Podgrodzie, Olsztyn, warmińsko-mazurskie",319 000 zł,8368 zł/m²,2 pokoje,"38,12 m²",Biuro nieruchomości,/pl/oferta/2-pokojowe-mieszkanie-gotowe-do-zamieszkania-ID4o8Nk,01/16/24
Przytulne mieszkanie na parterze,"Mieszkanie na sprzedaż: Zbigniewa Herberta, Jaroty, Olsztyn, warmińsko-mazurskie",437 000 zł,9010 zł/m²,2 pokoje,"48,5 m²",Biuro nieruchomości,/pl/oferta/przytulne-mieszkanie-na-parterze-ID4o8KI,01/16/24
"Belweder - 2 pokoje, parter - zapraszam!","Mieszkanie na sprzedaż: ul. ks. Jerzego Popiełuszki, Osiedle Generałów, Olsztyn, warmińsko-mazurskie",449 000 zł,8989 zł/m²,2 pokoje,"49,95 m²",Biuro nieruchomości,/pl/oferta/belweder-2-pokoje-parter-zapraszam-ID4o8vf,01/16/24
Apartamenty Wyzwolenia | apartament nr 55,"Mieszkanie na sprzedaż: ul. Wyzwolenia, Śródmieście, Olsztyn, warmińsko-mazurskie",739 784 zł,12 400 zł/m²,3 pokoje,"59,66 m²",Inwestycja deweloperska,/pl/oferta/apartamenty-wyzwolenia-apartament-nr-55-ID4nyxV,01/16/24
Warszawska99 | mieszkanie 2-pok. | 16,"Mieszkanie na sprzedaż: al. Aleja Warszawska, Kortowo, Olsztyn, warmińsko-mazurskie",,,2 pokoje,"43,75 m²",Inwestycja deweloperska,/pl/oferta/warszawska99-mieszkanie-2-pok-16-ID4ntXr,01/16/24
Mieszkanie do remontu z ogrodem i garażem,"Mieszkanie na sprzedaż: ul. Jana Bażyńskiego, Osiedle Grunwaldzkie, Olsztyn, warmińsko-mazurskie",449 000 zł,6803 zł/m²,3 pokoje,66 m²,Biuro nieruchomości,/pl/oferta/mieszkanie-do-remontu-z-ogrodem-i-garazem-ID4o7B1,01/16/24
Apartamenty Wyzwolenia | apartament nr 51,"Mieszkanie na sprzedaż: ul. Wyzwolenia, Śródmieście, Olsztyn, warmińsko-mazurskie",517 824 zł,12 400 zł/m²,2 pokoje,"41,76 m²",Inwestycja deweloperska,/pl/oferta/apartamenty-wyzwolenia-apartament-nr-51-ID4nyxW,01/16/24
"Mieszkanie z potencjałem na 4 pokoje, Pojezierze","Mieszkanie na sprzedaż: Pojezierze, Olsztyn, warmińsko-mazurskie",329 000 zł,6173 zł/m²,4 pokoje,"53,3 m²",Biuro nieruchomości,/pl/oferta/mieszkanie-z-potencjalem-na-4-pokoje-pojezierze-ID4o7gq,01/16/24
Warszawska99 | mieszkanie 2-pok. | 52,"Mieszkanie na sprzedaż: al. Aleja Warszawska, Kortowo, Olsztyn, warmińsko-mazurskie",,,2 pokoje,"48,08 m²",Inwestycja deweloperska,/pl/oferta/warszawska99-mieszkanie-2-pok-52-ID4nu1w,01/16/24
"Jaroty, 2-pokojowe mieszkanie z balkonem, 47,9 m2","Mieszkanie na sprzedaż: ul. Johanna Gottfrieda Herdera, Jaroty, Olsztyn, warmińsko-mazurskie",349 000 zł,7286 zł/m²,2 pokoje,"47,9 m²",Biuro nieruchomości,/pl/oferta/jaroty-2-pokojowe-mieszkanie-z-balkonem-47-9-m2-ID4nHRC,01/16/24
Trzy pokojowy Apartament w centrum!,"Mieszkanie na sprzedaż: Pojezierze, Olsztyn, warmińsko-mazurskie",720 000 zł,12 000 zł/m²,3 pokoje,60 m²,Biuro nieruchomości,/pl/oferta/trzy-pokojowy-apartament-w-centrum-ID4o6Rk,01/16/24
"Os.Morena, 2-pok. mieszkanie, 2 balkony, m.postoj.","Mieszkanie na sprzedaż: ul. Morenowa, Bartąg, Stawiguda, olsztyński, warmińsko-mazurskie",525 000 zł,10 214 zł/m²,2 pokoje,"51,4 m²",Biuro nieruchomości,/pl/oferta/os-morena-2-pok-mieszkanie-2-balkony-m-postoj-ID4o6sh,01/16/24
Mieszkanie do zamieszkania Pojezierze - Dworcowa,"Mieszkanie na sprzedaż: ul. Pana Tadeusza, Pojezierze, Olsztyn, warmińsko-mazurskie",329 000 zł,10 281 zł/m²,2 pokoje,32 m²,Biuro nieruchomości,/pl/oferta/mieszkanie-do-zamieszkania-pojezierze-dworcowa-ID4o6ni,01/16/24
Apartamenty Wyzwolenia | apartament nr 53,"Mieszkanie na sprzedaż: ul. Wyzwolenia, Śródmieście, Olsztyn, warmińsko-mazurskie",739 660 zł,12 400 zł/m²,3 pokoje,"59,65 m²",Inwestycja deweloperska,/pl/oferta/apartamenty-wyzwolenia-apartament-nr-53-ID4nyxU,01/16/24
Jarocka 21A - 2 pokoje + parking - nowy blok,"Mieszkanie na sprzedaż: ul. Jarocka, Jaroty, Olsztyn, warmińsko-mazurskie",445 000 zł,12 902 zł/m²,2 pokoje,"34,49 m²",Biuro nieruchomości,/pl/oferta/jarocka-21a-2-pokoje-parking-nowy-blok-ID4nIhE,01/16/24
Mieszkanie w doskonałej lokalizacji,"Mieszkanie na sprzedaż: ul. Kardynała Stefana Wyszyńskiego, Kormoran, Olsztyn, warmińsko-mazurskie",460 000 zł,9583 zł/m²,3 pokoje,48 m²,48 m²,/pl/oferta/mieszkanie-w-doskonalej-lokalizacji-ID4o5WO,01/16/24
Apartamenty Wyzwolenia | apartament nr 50,"Mieszkanie na sprzedaż: ul. Wyzwolenia, Śródmieście, Olsztyn, warmińsko-mazurskie",523 900 zł,12 400 zł/m²,2 pokoje,"42,25 m²",Inwestycja deweloperska,/pl/oferta/apartamenty-wyzwolenia-apartament-nr-50-ID4nyxT,01/16/24
Warszawska99 | mieszkanie 3-pok. | 49,"Mieszkanie na sprzedaż: al. Aleja Warszawska, Kortowo, Olsztyn, warmińsko-mazurskie",,,3 pokoje,"62,15 m²",Inwestycja deweloperska,/pl/oferta/warszawska99-mieszkanie-3-pok-49-ID4nu47,01/16/24
"Przestronne, 5pokojowe mieszkanie na Jarotach!","Mieszkanie na sprzedaż: ul. Edwarda Mroza, Jaroty, Olsztyn, warmińsko-mazurskie",619 000 zł,4421 zł/m²,5 pokoi,140 m²,Biuro nieruchomości,/pl/oferta/przestronne-5pokojowe-mieszkanie-na-jarotach-ID4o1Ib,01/16/24
"Piękne dwupoziomowe mieszkanie, do wprowadzenia","Mieszkanie na sprzedaż: ul. Antoniego Małeckiego, Osiedle Wojska Polskiego, Olsztyn, warmińsko-mazurskie",690 000 zł,6977 zł/m²,3 pokoje,"98,9 m²",Biuro nieruchomości,/pl/oferta/piekne-dwupoziomowe-mieszkanie-do-wprowadzenia-ID4o5ET,01/16/24
Apartamenty Wyzwolenia | apartament nr 91,"Mieszkanie na sprzedaż: ul. Wyzwolenia, Śródmieście, Olsztyn, warmińsko-mazurskie",394 680 zł,13 000 zł/m²,1 pokój,"30,36 m²",Inwestycja deweloperska,/pl/oferta/apartamenty-wyzwolenia-apartament-nr-91-ID4nyyv,01/16/24
Nowe wykończone 2 pokojowe mieszkanie,"Mieszkanie na sprzedaż: Pojezierze, Olsztyn, warmińsko-mazurskie",458 000 zł,9726 zł/m²,2 pokoje,"47,09 m²",Biuro nieruchomości,/pl/oferta/nowe-wykonczone-2-pokojowe-mieszkanie-ID4o5ic,01/16/24
"Mieszkanie na parterze -Jaroty 48,5 m2","Mieszkanie na sprzedaż: Śródmieście, Olsztyn, warmińsko-mazurskie",437 000 zł,9010 zł/m²,2 pokoje,"48,5 m²",Biuro nieruchomości,/pl/oferta/mieszkanie-na-parterze-jaroty-48-5-m2-ID4o5dX,01/16/24
Komfortowy apartament z widokiem na jezioro.,"Mieszkanie na sprzedaż: Osiedle Nad Jeziorem Długim, Olsztyn, warmińsko-mazurskie",1 192 000 zł,11 462 zł/m²,4 pokoje,104 m²,Biuro nieruchomości,/pl/oferta/komfortowy-apartament-z-widokiem-na-jezioro-ID4o56x,01/16/24
Mieszkanie z Garażem w Cenie - Jaroty,"Mieszkanie na sprzedaż: os. Tęczowy Las, Bartąg, Stawiguda, olsztyński, warmińsko-mazurskie",539 000 zł,12 365 zł/m²,2 pokoje,"43,59 m²",Biuro nieruchomości,/pl/oferta/mieszkanie-z-garazem-w-cenie-jaroty-ID4o4WP,01/16/24
"4 pokoje,65 m2,dwupoziomowe,Polna,Podgrodzie","Mieszkanie na sprzedaż: ul. Polna, Podgrodzie, Olsztyn, warmińsko-mazurskie",549 000 zł,8382 zł/m²,4 pokoje,"65,5 m²",Biuro nieruchomości,/pl/oferta/4-pokoje-65-m2-dwupoziomowe-polna-podgrodzie-ID4o4Ai,01/16/24
Warszawska99 | mieszkanie 2-pok. | 23,"Mieszkanie na sprzedaż: al. Aleja Warszawska, Kortowo, Olsztyn, warmińsko-mazurskie",,,2 pokoje,"43,77 m²",Inwestycja deweloperska,/pl/oferta/warszawska99-mieszkanie-2-pok-23-ID4ntXU,01/16/24
Apartamenty Wyzwolenia | apartament nr 95,"Mieszkanie na sprzedaż: ul. Wyzwolenia, Śródmieście, Olsztyn, warmińsko-mazurskie",549 250 zł,13 000 zł/m²,2 pokoje,"42,25 m²",Inwestycja deweloperska,/pl/oferta/apartamenty-wyzwolenia-apartament-nr-95-ID4nyyy,01/16/24
"4pokojowe,umeblowane, po remoncie","Mieszkanie na sprzedaż: al. Aleja Marszałka Józefa Piłsudskiego, Osiedle Mazurskie, Olsztyn, warmińsko-mazurskie",449 000 zł,7755 zł/m²,4 pokoje,"57,9 m²",Biuro nieruchomości,/pl/oferta/4pokojowe-umeblowane-po-remoncie-ID4nF90,01/16/24
Mieszkanie 2 pokoje w centrum Olsztyna-Partyzantów,"Mieszkanie na sprzedaż: ul. Partyzantów, Osiedle Kętrzyńskiego, Olsztyn, warmińsko-mazurskie",519 000 zł,6611 zł/m²,2 pokoje,"78,5 m²",Biuro nieruchomości,/pl/oferta/mieszkanie-2-pokoje-w-centrum-olsztyna-partyzantow-ID4o44K,01/16/24
"1-pok ul. Słowackiego 25,2 m2(po podłodze 40 m2)","Mieszkanie na sprzedaż: ul. Juliusza Słowackiego, Podleśna, Olsztyn, warmińsko-mazurskie",259 000 zł,10 278 zł/m²,1 pokój,"25,2 m²",Biuro nieruchomości,/pl/oferta/1-pok-ul-slowackiego-25-2-m2po-podlodze-40-m2-ID4o3Yf,01/16/24
3 pokoje Olsztyn Zatorze,"Mieszkanie na sprzedaż: ul. Marii Zientary-Malewskiej, Zielona Górka, Olsztyn, warmińsko-mazurskie",399 000 zł,6963 zł/m²,3 pokoje,"57,3 m²",Biuro nieruchomości,/pl/oferta/3-pokoje-olsztyn-zatorze-ID4o3OK,01/16/24
"Tulipanowa - 4 pokoje, parter z dużym ogrodem","Mieszkanie na sprzedaż: ul. Tulipanowa, Redykajny, Olsztyn, warmińsko-mazurskie",699 000 zł,7389 zł/m²,4 pokoje,"94,6 m²",Biuro nieruchomości,/pl/oferta/tulipanowa-4-pokoje-parter-z-duzym-ogrodem-ID4o3OD,01/16/24
"Curie Skłodowskiej - 122.29m2, 4 pokoje, 3 piętro","Mieszkanie na sprzedaż: ul. Marii Curie-Skłodowskiej, Śródmieście, Olsztyn, warmińsko-mazurskie",672 595 zł,5500 zł/m²,4 pokoje,"122,29 m²",Biuro nieruchomości,/pl/oferta/curie-sklodowskiej-122-29m2-4-pokoje-3-pietro-ID4o3OC,01/16/24
"3 pokoje, ul. Wyzwolenia","Mieszkanie na sprzedaż: ul. Wyzwolenia, Śródmieście, Olsztyn, warmińsko-mazurskie",369 000 zł,6531 zł/m²,3 pokoje,"56,5 m²",Biuro nieruchomości,/pl/oferta/3-pokoje-ul-wyzwolenia-ID4o3OA,01/16/24
Mieszkanie 2 pokojowe 1 piętro Zatorze,"Mieszkanie na sprzedaż: ul. Mieczysława Niedziałkowskiego, Zatorze, Olsztyn, warmińsko-mazurskie",325 000 zł,6250 zł/m²,2 pokoje,52 m²,Biuro nieruchomości,/pl/oferta/mieszkanie-2-pokojowe-1-pietro-zatorze-ID4o3zk,01/16/24
Przestronne mieszkanie w centrum Olsztyna,"Mieszkanie na sprzedaż: ul. Ratuszowa, Śródmieście, Olsztyn, warmińsko-mazurskie",590 000 zł,5438 zł/m²,5 pokoi,"108,5 m²",Biuro nieruchomości,/pl/oferta/przestronne-mieszkanie-w-centrum-olsztyna-ID4mwzW,01/16/24
"3 pokoje, pow. 59,9 m2, winda, ul. Dworcowa","Mieszkanie na sprzedaż: ul. Dworcowa, Kormoran, Olsztyn, warmińsko-mazurskie",418 500 zł,6998 zł/m²,3 pokoje,"59,8 m²",Biuro nieruchomości,/pl/oferta/3-pokoje-pow-59-9-m2-winda-ul-dworcowa-ID4o39C,01/16/24
Idealne dla singla/pary - REZERWACJA!,"Mieszkanie na sprzedaż: ul. Tarasa Szewczenki, Podleśna, Olsztyn, warmińsko-mazurskie",289 000 zł,8217 zł/m²,2 pokoje,"35,17 m²",Biuro nieruchomości,/pl/oferta/idealne-dla-singla-pary-rezerwacja-ID4nLtC,01/16/24
Zamieszkaj w sercu Starego Miasta w Olsztynie,"Mieszkanie na sprzedaż: ul. Staromiejska, Śródmieście, Olsztyn, warmińsko-mazurskie",450 000 zł,7355 zł/m²,3 pokoje,"61,18 m²",Biuro nieruchomości,/pl/oferta/zamieszkaj-w-sercu-starego-miasta-w-olsztynie-ID4o2YH,01/16/24
Apartament przy Starówce,"Mieszkanie na sprzedaż: ul. Grunwaldzka, Osiedle Grunwaldzkie, Olsztyn, warmińsko-mazurskie",480 000 zł,11 625 zł/m²,2 pokoje,"41,29 m²",Biuro nieruchomości,/pl/oferta/apartament-przy-starowce-ID4o2m5,01/16/24
Mieszkanie - Olsztyn,"Mieszkanie na sprzedaż: ul. Jasna, Osiedle Kętrzyńskiego, Olsztyn, warmińsko-mazurskie",410 000 zł,6001 zł/m²,4 pokoje,"68,32 m²",Biuro nieruchomości,/pl/oferta/mieszkanie-olsztyn-ID4o1S5,01/16/24
Warszawska99 | mieszkanie 2-pok. | 43,"Mieszkanie na sprzedaż: al. Aleja Warszawska, Kortowo, Olsztyn, warmińsko-mazurskie",,,2 pokoje,"45,65 m²",Inwestycja deweloperska,/pl/oferta/warszawska99-mieszkanie-2-pok-43-ID4ntYt,01/16/24
"Mieszkanie, 43,99 m², Olsztyn","Mieszkanie na sprzedaż: Śródmieście, Olsztyn, warmińsko-mazurskie",560 000 zł,12 730 zł/m²,2 pokoje,"43,99 m²",Biuro nieruchomości,/pl/oferta/mieszkanie-43-99-m-olsztyn-ID4o1qv,01/16/24
Świetny rozkład - 4 pokoje + duża piwnica 10m,"Mieszkanie na sprzedaż: Herberta, Jaroty, Olsztyn, warmińsko-mazurskie",469 000 zł,6228 zł/m²,3 pokoje,"75,3 m²",Biuro nieruchomości,/pl/oferta/swietny-rozklad-4-pokoje-duza-piwnica-10m-ID4kXiL,01/16/24
"Ostatnie Mieszkania W Centrum, 3 Pokoje 56 M","Mieszkanie na sprzedaż: ul. Dąbrowszczaków, Osiedle Kętrzyńskiego, Olsztyn, warmińsko-mazurskie",498 256 zł,8800 zł/m²,3 pokoje,"56,62 m²",Biuro nieruchomości,/pl/oferta/ostatnie-mieszkania-w-centrum-3-pokoje-56-m-ID45QBh,01/16/24
Urocze mieszkanie na osiedlu Pojezierze,"Mieszkanie na sprzedaż: ul. Kołobrzeska, Pojezierze, Olsztyn, warmińsko-mazurskie",310 000 zł,9091 zł/m²,2 pokoje,"34,1 m²",Biuro nieruchomości,/pl/oferta/urocze-mieszkanie-na-osiedlu-pojezierze-ID4lL49,01/16/24
Warszawska99 | mieszkanie 2-pok. | 58,"Mieszkanie na sprzedaż: al. Aleja Warszawska, Kortowo, Olsztyn, warmińsko-mazurskie",,,2 pokoje,"45,65 m²",Inwestycja deweloperska,/pl/oferta/warszawska99-mieszkanie-2-pok-58-ID4ntYW,01/16/24
Dwupokojowe mieszkanie z balkonem,"Mieszkanie na sprzedaż: Osiedle Generałów, Olsztyn, warmińsko-mazurskie",369 000 zł,8954 zł/m²,2 pokoje,"41,21 m²",Biuro nieruchomości,/pl/oferta/dwupokojowe-mieszkanie-z-balkonem-ID4o0kg,01/16/24
Warszawska99 | mieszkanie 2-pok. | 39,"Mieszkanie na sprzedaż: al. Aleja Warszawska, Kortowo, Olsztyn, warmińsko-mazurskie",,,2 pokoje,"43,83 m²",Inwestycja deweloperska,/pl/oferta/warszawska99-mieszkanie-2-pok-39-ID4ntYo,01/16/24
Apartamenty Wyzwolenia | apartament nr 72,"Mieszkanie na sprzedaż: ul. Wyzwolenia, Śródmieście, Olsztyn, warmińsko-mazurskie",534 528 zł,12 800 zł/m²,2 pokoje,"41,76 m²",Inwestycja deweloperska,/pl/oferta/apartamenty-wyzwolenia-apartament-nr-72-ID4nyyt,01/16/24
Warszawska99 | mieszkanie 2-pok. | 57,"Mieszkanie na sprzedaż: al. Aleja Warszawska, Kortowo, Olsztyn, warmińsko-mazurskie",,,2 pokoje,"48,08 m²",Inwestycja deweloperska,/pl/oferta/warszawska99-mieszkanie-2-pok-57-ID4nu1v,01/16/24
Warszawska99 | mieszkanie 2-pok. | 30,"Mieszkanie na sprzedaż: al. Aleja Warszawska, Kortowo, Olsztyn, warmińsko-mazurskie",,,2 pokoje,"43,77 m²",Inwestycja deweloperska,/pl/oferta/warszawska99-mieszkanie-2-pok-30-ID4ntY7,01/16/24
Warszawska99 | mieszkanie 3-pok. | 45,"Mieszkanie na sprzedaż: al. Aleja Warszawska, Kortowo, Olsztyn, warmińsko-mazurskie",,,3 pokoje,"60,59 m²",Inwestycja deweloperska,/pl/oferta/warszawska99-mieszkanie-3-pok-45-ID4nu2m,01/16/24
Mieszkanie dwupoziomowe z kominkiem!,"Mieszkanie na sprzedaż: Osiedle Kościuszki, Olsztyn, warmińsko-mazurskie",749 000 zł,6683 zł/m²,4 pokoje,"112,08 m²",Biuro nieruchomości,/pl/oferta/mieszkanie-dwupoziomowe-z-kominkiem-ID4nZnX,01/16/24
Apartamenty Wyzwolenia | apartament nr 57,"Mieszkanie na sprzedaż: ul. Wyzwolenia, Śródmieście, Olsztyn, warmińsko-mazurskie",517 824 zł,12 400 zł/m²,2 pokoje,"41,76 m²",Inwestycja deweloperska,/pl/oferta/apartamenty-wyzwolenia-apartament-nr-57-ID4nyxY,01/16/24
Warszawska99 | mieszkanie 3-pok. | 44,"Mieszkanie na sprzedaż: al. Aleja Warszawska, Kortowo, Olsztyn, warmińsko-mazurskie",,,3 pokoje,"62,15 m²",Inwestycja deweloperska,/pl/oferta/warszawska99-mieszkanie-3-pok-44-ID4nu42,01/16/24
Świetne dwupoziomowe mieszkanie na Os. Mleczna!,"Mieszkanie na sprzedaż: ul. Jarosława Iwaszkiewicza, Podgrodzie, Olsztyn, warmińsko-mazurskie",587 000 zł,11 013 zł/m²,3 pokoje,"53,3 m²",Biuro nieruchomości,/pl/oferta/swietne-dwupoziomowe-mieszkanie-na-os-mleczna-ID4nZeh,01/16/24
Warszawska99 | mieszkanie 2-pok. | 14,"Mieszkanie na sprzedaż: al. Aleja Warszawska, Kortowo, Olsztyn, warmińsko-mazurskie",503 355 zł,11 500 zł/m²,2 pokoje,"43,77 m²",Inwestycja deweloperska,/pl/oferta/warszawska99-mieszkanie-2-pok-14-ID4ntXS,01/16/24
Warszawska99 | mieszkanie 3-pok. | 17,"Mieszkanie na sprzedaż: al. Aleja Warszawska, Kortowo, Olsztyn, warmińsko-mazurskie",,,3 pokoje,"60,74 m²",Inwestycja deweloperska,/pl/oferta/warszawska99-mieszkanie-3-pok-17-ID4nu3s,01/16/24
2w1 Mieszkanie i Lokal,"Mieszkanie na sprzedaż: Kormoran, Olsztyn, warmińsko-mazurskie",619 000 zł,8145 zł/m²,3 pokoje,76 m²,Biuro nieruchomości,/pl/oferta/2w1-mieszkanie-i-lokal-ID4nXS3,01/16/24
Mieszkanie w kamienicy do własnej aranżacji !,"Mieszkanie na sprzedaż: ul. Tadeusza Kościuszki, Osiedle Kętrzyńskiego, Olsztyn, warmińsko-mazurskie",580 000 zł,5378 zł/m²,6 pokoi,"107,85 m²",Biuro nieruchomości,/pl/oferta/mieszkanie-w-kamienicy-do-wlasnej-aranzacji-ID4nXyh,01/16/24
Mieszkanie do remontu Zatorze- Rezerwacja,"Mieszkanie na sprzedaż: ul. Poprzeczna, Podleśna, Olsztyn, warmińsko-mazurskie",375 000 zł,5494 zł/m²,3 pokoje,"68,26 m²",Biuro nieruchomości,/pl/oferta/mieszkanie-do-remontu-zatorze-rezerwacja-ID4nXu0,01/16/24
Mieszkanie gotowe do wprowadzenia,"Mieszkanie na sprzedaż: ul. gen. Franciszka Kleeberga, Osiedle Generałów, Olsztyn, warmińsko-mazurskie",549 000 zł,7111 zł/m²,4 pokoje,"77,2 m²",Biuro nieruchomości,/pl/oferta/mieszkanie-gotowe-do-wprowadzenia-ID4nXmU,01/16/24
Warszawska99 | mieszkanie 2-pok. | 47,"Mieszkanie na sprzedaż: al. Aleja Warszawska, Kortowo, Olsztyn, warmińsko-mazurskie",552 920 zł,11 500 zł/m²,2 pokoje,"48,08 m²",Inwestycja deweloperska,/pl/oferta/warszawska99-mieszkanie-2-pok-47-ID4nu1r,01/16/24
Warszawska99 | mieszkanie 2-pok. | 25,"Mieszkanie na sprzedaż: al. Aleja Warszawska, Kortowo, Olsztyn, warmińsko-mazurskie",,,2 pokoje,"43,75 m²",Inwestycja deweloperska,/pl/oferta/warszawska99-mieszkanie-2-pok-25-ID4ntXO,01/16/24
"3 pokoje,Limanowskiego,61m2,369000zł.,negocjacje","Mieszkanie na sprzedaż: Zatorze, Olsztyn, warmińsko-mazurskie",369 000 zł,6049 zł/m²,3 pokoje,61 m²,Biuro nieruchomości,/pl/oferta/3-pokoje-limanowskiego-61m2-369000zl-negocjacje-ID4nVq6,01/16/24
Apartamenty wakacyjne nad jeziorem Ukiel,"Mieszkanie na sprzedaż: ul. Sielska, Dajtki, Olsztyn, warmińsko-mazurskie",396 330 zł,11 000 zł/m²,2 pokoje,"36,03 m²",Biuro nieruchomości,/pl/oferta/apartamenty-wakacyjne-nad-jeziorem-ukiel-ID4fvHW,01/16/24
Apartamenty Wyzwolenia | apartament nr 34,"Mieszkanie na sprzedaż: ul. Wyzwolenia, Śródmieście, Olsztyn, warmińsko-mazurskie",554 838 zł,9300 zł/m²,3 pokoje,"59,66 m²",Inwestycja deweloperska,/pl/oferta/apartamenty-wyzwolenia-apartament-nr-34-ID4chH7,01/16/24
Warszawska99 | mieszkanie 2-pok. | 37,"Mieszkanie na sprzedaż: al. Aleja Warszawska, Kortowo, Olsztyn, warmińsko-mazurskie",,,2 pokoje,"43,75 m²",Inwestycja deweloperska,/pl/oferta/warszawska99-mieszkanie-2-pok-37-ID4ntXQ,01/16/24
"Osiedle Versal, 2 pok. 50,6 m2, 5p z klimatyzacją","Mieszkanie na sprzedaż: ul. Armii Krajowej, Osiedle Grunwaldzkie, Olsztyn, warmińsko-mazurskie",595 000 zł,12 045 zł/m²,2 pokoje,"49,4 m²",Biuro nieruchomości,/pl/oferta/osiedle-versal-2-pok-50-6-m2-5p-z-klimatyzacja-ID4nWSe,01/16/24
A.58 2-pokojowy apartament przy jeziorze Ukiel,"Mieszkanie na sprzedaż: ul. Sielska, Dajtki, Olsztyn, warmińsko-mazurskie",687 570 zł,18 832 zł/m²,2 pokoje,"36,51 m²",Inwestycja deweloperska,/pl/oferta/a-58-2-pokojowy-apartament-przy-jeziorze-ukiel-ID4kXTb,01/16/24
Warszawska99 | mieszkanie 3-pok. | 26,"Mieszkanie na sprzedaż: al. Aleja Warszawska, Kortowo, Olsztyn, warmińsko-mazurskie",655 992 zł,10 800 zł/m²,3 pokoje,"60,74 m²",Inwestycja deweloperska,/pl/oferta/warszawska99-mieszkanie-3-pok-26-ID4nu3W,01/16/24
REZERWACJA mieszkanie 2,"Mieszkanie na sprzedaż: ul. Wojciecha Kętrzyńskiego, Osiedle Kętrzyńskiego, Olsztyn, warmińsko-mazurskie","420 235,50 zł",8430 zł/m²,3 pokoje,"49,85 m²",Inwestycja deweloperska,/pl/oferta/rezerwacja-mieszkanie-2-ID4eY0n,01/16/24
A.34 2-pokojowy apartament przy jeziorze Ukiel,"Mieszkanie na sprzedaż: ul. Sielska, Dajtki, Olsztyn, warmińsko-mazurskie",687 570 zł,18 832 zł/m²,2 pokoje,"36,51 m²",Inwestycja deweloperska,/pl/oferta/a-34-2-pokojowy-apartament-przy-jeziorze-ukiel-ID4kXT6,01/16/24
Mieszkanie bezczynszowe z własnym ogródkiem,"Mieszkanie na sprzedaż: Gutkowo, Olsztyn, warmińsko-mazurskie",660 000 zł,5973 zł/m²,5 pokoi,"110,5 m²",Inwestycja deweloperska,/pl/oferta/mieszkanie-bezczynszowe-z-wlasnym-ogrodkiem-ID4giRI,01/16/24
Villa Symfonia | Olsztyn | M28,"Mieszkanie na sprzedaż: ul. Wojciecha Kętrzyńskiego, Osiedle Kętrzyńskiego, Olsztyn, warmińsko-mazurskie",678 193 zł,8300 zł/m²,4 pokoje,"81,71 m²",Inwestycja deweloperska,/pl/oferta/villa-symfonia-olsztyn-m28-ID4eTH9,01/16/24
A.04 2-pokojowy apartament przy jeziorze Ukiel,"Mieszkanie na sprzedaż: ul. Sielska, Dajtki, Olsztyn, warmińsko-mazurskie",1 167 270 zł,26 248 zł/m²,2 pokoje,"44,47 m²",Inwestycja deweloperska,/pl/oferta/a-04-2-pokojowy-apartament-przy-jeziorze-ukiel-ID4kXSF,01/16/24
Os. Leśna| widok na panoramę miasta A.III/39,"Mieszkanie na sprzedaż: ul. Leśna, Osiedle Nad Jeziorem Długim, Olsztyn, warmińsko-mazurskie",,,2 pokoje,"42,51 m²",Inwestycja deweloperska,/pl/oferta/os-lesna-widok-na-panorame-miasta-a-iii-39-ID4bpBj,01/16/24
Villa Symfonia | Olsztyn | mieszkanie M23,"Mieszkanie na sprzedaż: ul. Wojciecha Kętrzyńskiego, Osiedle Kętrzyńskiego, Olsztyn, warmińsko-mazurskie",661 759 zł,8300 zł/m²,5 pokoi,"79,73 m²",Inwestycja deweloperska,/pl/oferta/villa-symfonia-olsztyn-mieszkanie-m23-ID4eY1v,01/16/24
A.61 2-pokojowy apartament przy jeziorze Ukiel,"Mieszkanie na sprzedaż: ul. Sielska, Dajtki, Olsztyn, warmińsko-mazurskie",687 570 zł,18 832 zł/m²,2 pokoje,"36,51 m²",Inwestycja deweloperska,/pl/oferta/a-61-2-pokojowy-apartament-przy-jeziorze-ukiel-ID4kXSY,01/16/24
Os. Leśna | widok na panoramę miasta A.III/40,"Mieszkanie na sprzedaż: ul. Leśna, Osiedle Nad Jeziorem Długim, Olsztyn, warmińsko-mazurskie",,,2 pokoje,"42,31 m²",Inwestycja deweloperska,/pl/oferta/os-lesna-widok-na-panorame-miasta-a-iii-40-ID4bpBg,01/16/24
Warszawska99 | mieszkanie 3-pok. | 8,"Mieszkanie na sprzedaż: al. Aleja Warszawska, Kortowo, Olsztyn, warmińsko-mazurskie",655 992 zł,10 800 zł/m²,3 pokoje,"60,74 m²",Inwestycja deweloperska,/pl/oferta/warszawska99-mieszkanie-3-pok-8-ID4nu6J,01/16/24
"Mieszkanie z Panoramą Miasta, ul. Jagiellońska","Mieszkanie na sprzedaż: Zatorze, Olsztyn, warmińsko-mazurskie",387 000 zł,7140 zł/m²,2 pokoje,"54,2 m²",Biuro nieruchomości,/pl/oferta/mieszkanie-z-panorama-miasta-ul-jagiellonska-ID4nTgf,01/16/24
Kawalerka ul.Jagiellońska15- 1 pietro! 229Tyś!,"Mieszkanie na sprzedaż: Śródmieście, Olsztyn, warmińsko-mazurskie",229 000 zł,6836 zł/m²,1 pokój,"33,5 m²",Biuro nieruchomości,/pl/oferta/kawalerka-ul-jagiellonska15-1-pietro-229tys-ID4nSTm,01/16/24
Mieszkanie 50 m2 w centrum miasta,"Mieszkanie na sprzedaż: ul. Niepodległości, Osiedle Kościuszki, Olsztyn, warmińsko-mazurskie",429 000 zł,8517 zł/m²,2 pokoje,"50,37 m²",Biuro nieruchomości,/pl/oferta/mieszkanie-50-m2-w-centrum-miasta-ID4nIjR,01/16/24
A.36 Apartament przy plaży jeziora Ukiel,"Mieszkanie na sprzedaż: ul. Sielska, Dajtki, Olsztyn, warmińsko-mazurskie",687 570 zł,18 832 zł/m²,2 pokoje,"36,51 m²",Inwestycja deweloperska,/pl/oferta/a-36-apartament-przy-plazy-jeziora-ukiel-ID4kXSS,01/16/24
"Duże, nowoczesne mieszkanie z ogródkiem","Mieszkanie na sprzedaż: ul. Żurawia, Gutkowo, Olsztyn, warmińsko-mazurskie",849 000 zł,9123 zł/m²,4 pokoje,"93,06 m²",Biuro nieruchomości,/pl/oferta/duze-nowoczesne-mieszkanie-z-ogrodkiem-ID4nSB0,01/16/24
"Osiedle Belweder, 3 pokoje na parterze.","Mieszkanie na sprzedaż: Śródmieście, Olsztyn, warmińsko-mazurskie",500 000 zł,9615 zł/m²,3 pokoje,52 m²,Biuro nieruchomości,/pl/oferta/osiedle-belweder-3-pokoje-na-parterze-ID4nSu9,01/16/24
"3 pokoje+jadalnia, mieszkanie(74,9 m2)ul.Jaroszyka","Mieszkanie na sprzedaż: ul. Kazimierza Jaroszyka, Jaroty, Olsztyn, warmińsko-mazurskie",550 000 zł,7343 zł/m²,4 pokoje,"74,9 m²",Biuro nieruchomości,/pl/oferta/3-pokoje-jadalnia-mieszkanie74-9-m2ul-jaroszyka-ID4nRSs,01/16/24
"""Nowe Zatorze"" 4 pokoje + 2msc garażowe + piwnica","Mieszkanie na sprzedaż: ul. Marii Zientary-Malewskiej, Zielona Górka, Olsztyn, warmińsko-mazurskie",805 000 zł,11 457 zł/m²,4 pokoje,"70,26 m²",Biuro nieruchomości,/pl/oferta/nowe-zatorze-4-pokoje-2msc-garazowe-piwnica-ID4nsid,01/16/24
Villa Symfonia | Olsztyn | mieszkanie M47,"Mieszkanie na sprzedaż: ul. Wojciecha Kętrzyńskiego, Osiedle Kętrzyńskiego, Olsztyn, warmińsko-mazurskie",652 050 zł,8280 zł/m²,4 pokoje,"78,75 m²",Inwestycja deweloperska,/pl/oferta/villa-symfonia-olsztyn-mieszkanie-m47-ID4eY2q,01/16/24
Wyspiańskiego - w promieniach centrum,"Mieszkanie na sprzedaż: Osiedle Wojska Polskiego, Olsztyn, warmińsko-mazurskie",548 796 zł,12 450 zł/m²,2 pokoje,"44,08 m²",Biuro nieruchomości,/pl/oferta/wyspianskiego-w-promieniach-centrum-ID4hoCA,01/16/24
Wyspiańskiego - w promieniach centrum,"Mieszkanie na sprzedaż: Osiedle Wojska Polskiego, Olsztyn, warmińsko-mazurskie",759 600 zł,12 000 zł/m²,3 pokoje,"63,3 m²",Biuro nieruchomości,/pl/oferta/wyspianskiego-w-promieniach-centrum-ID4iu9B,01/16/24
Wyspiańskiego - w promieniach centrum,"Mieszkanie na sprzedaż: Osiedle Wojska Polskiego, Olsztyn, warmińsko-mazurskie",1 948 660 zł,14 000 zł/m²,5 pokoi,"139,19 m²",Biuro nieruchomości,/pl/oferta/wyspianskiego-w-promieniach-centrum-ID4iu9y,01/16/24
Apartament Wyspiańskiego- wykończony,"Mieszkanie na sprzedaż: Osiedle Wojska Polskiego, Olsztyn, warmińsko-mazurskie",993 810 zł,15 700 zł/m²,3 pokoje,"63,3 m²",Biuro nieruchomości,/pl/oferta/apartament-wyspianskiego-wykonczony-ID4iu9t,01/16/24
Warszawska99 | mieszkanie 3-pok. | 60,"Mieszkanie na sprzedaż: al. Aleja Warszawska, Kortowo, Olsztyn, warmińsko-mazurskie",,,3 pokoje,"60,59 m²",Inwestycja deweloperska,/pl/oferta/warszawska99-mieszkanie-3-pok-60-ID4nu2I,01/16/24
